,text,label
3600,! feliz sabado              ,joy
3601,ya no se si hacer algo o irme dormir  ,sadness
3602,ig                  ,joy
3603,tengo hambre                ,sadness
3604,"encanta "" mina ""            ",joy
3605,no tengo ni para el primer dia      ,sadness
3606,no se si llorar o irme lejos      ,sadness
3607,yo con estas pinch ganas y esta pinche lluvia no,anger
3608,tiene un par d bien          ,anger
3609,no estaba falta respeto hacia el sr verguenza mujer  ,anger
3610,porque gusta hacer pendejadas            ,sadness
3611,nunca desperte tantas veces en una noche por el calor,sadness
3612,necesito amistades nuevas para no estar aburrida un sabado como,joy
3613,yo en clase filosofia            ,joy
3614,no se hacer              ,sadness
3615,punto para mi no suelo cafe        ,joy
3616,un presidente si senor            ,anger
3617,se los plane jaja            ,sadness
3618,recien llego y ya quiero ir        ,sadness
3619,todavia no lo puedo creer  triste noticia otro angelito,sadness
3620,y bueno hoy casita no mas        ,joy
3621,hago cosas tan mal            ,sadness
3622,estoy muy contento ahora mi familia sabe soy    ,joy
3623,caminar con casi en calles e peor idea he tenido,joy
3624,tengo ganas besarte              ,sadness
3625,quiero un piercing en lengua          ,sadness
3626,entonces soy horrible              ,sadness
3627,maldita sea hpta vida            ,anger
3628,estoy totalmente cuando uno quiere algo cambie debe empezar por,joy
3629,quiero mi y mesa vuelta          ,sadness
3630,ahora si estoy confundida           ,sadness
3631,pone                  ,joy
3632,para tenia morir para fuera cierto el atentado sino no,anger
3633,siempre                  ,anger
3634,ojala le salga todo bien          ,sadness
3635,ay ay                ,anger
3636,hoy sera un domingo demasiado          ,joy
3637,siempre dije muerte era totalmente          ,sadness
3638,e imposible verlo y no llorar feo todo esto loco,sadness
3639,no interesa noticia si no paso nada bueno no saben,anger
3640,pase rapido agosto              ,sadness
3641,levantar                  ,sadness
3642,si cagas cagas peda y         ,joy
3643,se hizo muy dificil al principio pero ahora estoy y,sadness
3644,ese era esperanza para los          ,sadness
3645,tan van ser              ,anger
3646,"maldad e "" "" muchas fotos uribe y santos los",sadness
3647,voy comprar un solo para cortar        ,joy
3648,vida da vueltas y yo voy para arriba y el,joy
3649,un domingo                ,joy
3650,creo qe voy morir sin mi        ,sadness
3651,yo lo unico espero e tanto esfuerzo realmente valga pena,sadness
3652,le ha pasado conocen una mina no puede superar al,anger
3653,no hay peor cosa te hagan trampa en el  ,anger
3654,no se cuando va ser el dia pueda volver dormir,sadness
3655,por suerte tengo un grupo activo capaz no salimos un,joy
3656,como cuesta ser tierna            ,sadness
3657,e una linda noche para          ,joy
3658,peor no puedo sentir no          ,sadness
3659,mi y p por mi no hablamos ma nunca  ,sadness
3660,y en todos los los  no venden para  ,sadness
3661,recien e miercoles lpm            ,sadness
3662,muy buenos dias todos            ,joy
3663,el otro dia lo vi en el festival senti como,anger
3664,un para china esta            ,joy
3665,ganas salir hoy              ,sadness
3666,cuando pongo esa carita e pq se todo    ,joy
3667,pongo triste cuando se duerme y yo no tengo con,sadness
3668,ay no quiero entrar clases e muy enserio    ,sadness
3669,si soy por preocuparme por mi futuro y empezar cambiar,joy
3670,tio pasapalabrachv tu con nuestra ver jean en el programa,sadness
3671,cansancio mental tengo necesito            ,sadness
3672,uno esos dias en tu pecho        ,sadness
3673,tenia idea no verla en un y bajando al perro,joy
3674,maduro                  ,anger
3675,estoy ti aunque se no eres para mi y por,sadness
3676,to                  ,joy
3677,dios                  ,sadness
3678,vida no te quita cosas te cosas te para mas,joy
3679,casa del para algunos puntos con el      ,anger
3680,persona hermosa esta leyendo esto  solo quiero te quiero,joy
3681,eu                  ,joy
3682,ganas nada                ,sadness
3683,no se despierta  y le suena mi tweet  ,joy
3684,y para cuando alguien diga eso        ,sadness
3685,el dia esta para dormir          ,sadness
3686,bronca cuando tengo hacer algo y por x cosa no,anger
3687,siempre estoy buen humor cuando se trata ti aunque ni,sadness
3688,porque si no e ahora sera manana amor con una,joy
3689,neta esta horrible ti misma dejar persona una no eres,sadness
3690,cr                  ,anger
3691,buenos dias pais              ,sadness
3692,siempre cago por ser bien pinche        ,sadness
3693,mi domingo ya no son lo mismo luismi    ,sadness
3694,no se si reir o llorar        ,joy
3695,politica                  ,sadness
3696,buscar algun y encontrar            ,anger
3697,lo peor todo e manana arranco otra vez el colegio,sadness
3698,liga hp                ,anger
3699,lo unico entendi este tuit e su sentido del humor,sadness
3700,empezar 0 pero con vos          ,sadness
3701,ahora si un lindo bano          ,joy
3702,este e                ,anger
3703,volvi enamorarme ti mientras estabas lejos        ,sadness
3704,hace como 3 semanas no veo mi amigo y los,sadness
3705,esos recuerdos tienes y te el corazon en mil pedazos,sadness
3706,encanta cuando musica  otros lugares        ,joy
3707,ay dios                ,sadness
3708,mi humor puede cambiar un segundo para otro    ,joy
3709,estaba hasta no se quien llamo mi celular    ,anger
3710,ya le compre los regalos para el dia del nino,joy
3711,tengo los ojos ya            ,anger
3712,hay todo lo bonito vida para ser feliz    ,joy
3713,y tal le sus papa pues ya cenar invitaron y,joy
3714,hay ganas estar contigo            ,joy
3715,hagan lo hagan no canciones no sean asi    ,sadness
3716,queme un poquito              ,joy
3717,justo como hace un ano primer dia semestre y super,joy
3718,pedo los lugares comida traen al trabajo no los domingo,sadness
3719,viajo do normal              ,anger
3720,voy extranar salir casi toda semana con mi amigo ahora,sadness
3721,muchas gracias saludos              ,joy
3722,siempre voy amar              ,sadness
3723,y cada vez mas lpm autoestima ni hablar    ,sadness
3724,solo quiero sea miercoles quiero ver mi nada ma  ,sadness
3725,aaaaaa extrano pelear mi amigo  no los veo por,anger
3726,mi no                ,joy
3727,modo quiero comer y se un siglo estoy paro y,anger
3728,no puede ser tantos hombre chabon encima mi familia tienen,anger
3729,uy como he vuelto te ha pasado ante era ma,sadness
3730,querido hoy viendo pelis no importa no le    ,joy
3731,adios mi san carlos            ,sadness
3732,desde el                ,sadness
3733,si solo va estar mejor ni vengas      ,anger
3734,e todo plata hoy en dia en todos los  ,sadness
3735,existe algo mas feo perder los audifonos      ,sadness
3736,buenos dias  feliz dia todos los ninos y tambien,joy
3737,estoy como                ,sadness
3738,espero no cagarla en frances por neta no se nada,sadness
3739,trabajar los lunes en manana e aun mas dificil teniendo,sadness
3740,si alguno nivel frances o puede esto      ,joy
3741,manana empieza etapa final en el        ,sadness
3742,no aprendo ma              ,sadness
3743,no gusta saquen platica en el hospital para eso traigo,anger
3744,ese festivo si quedo            ,joy
3745,le pasa esta vieja pendeja del uber      ,anger
3746,el marido mi mama no viene mas y tengo una,anger
3747,vamos chula va salir estamos todos con vos fuerzas  ,sadness
3748,extrano esos dias secundaria saliendo iba con mi mejor amiga,sadness
3749,y                  ,joy
3750,mexico gano el pero como no e futbol pues le,sadness
3751,mae con esta parezco mi abuela escribiendo      ,sadness
3752,voy acostarme e intentar dormir agarro un re frio  ,sadness
3753,y mi novia donde esta un momento yo no tengo,sadness
3754,ya                  ,sadness
3755,estaba empezando con le valio madre y dejo hablando sola,joy
3756,no mames como pueden saber donde quedaron mile millones  ,anger
3757,te extrano                ,sadness
3758,quedo tranquila porque se todo vuelve        ,joy
3759,y para cuando se termina depresion post      ,sadness
3760,no hay cosa peor en el mundo te quite paz,anger
3761,oso cuando con ese            ,sadness
3762,ya esta ma              ,sadness
3763,porque los findes pasan tan rapido        ,sadness
3764,tiene re podrido el viento          ,anger
3765,no soy decime cosas una          ,anger
3766,al centro                ,joy
3767,encima e para ella se enoja        ,anger
3768,durante semana se fue los con d algo poco ,joy
3769,oh por dios igual amo          ,sadness
3770,buenos dia 8 ma favs y acabo este sorteo  ,joy
3771,nada como unos buenos para subir el animo    ,joy
3772,le valga madre si tengo una en nariz    ,anger
3773,si yo cambio todos mi          ,joy
3774,no gusta ducha su bano          ,joy
3775,importante y triste lo ale en instagram sobre como ante,anger
3776,sin comentarios mejor              ,sadness
3777,mi casa sin no e hogar        ,sadness
3778,cosas odio y el cabello          ,anger
3779,creo tengo depresion post viaje          ,sadness
3780,ultimo capitulo quinta vez            ,joy
3781,como hacen falta tus consejos te extrano      ,sadness
3782,los amigo aparecen peores situaciones          ,joy
3783,yo conozco solo uno el amor camiseta y confianza en,joy
3784,quiero ir al parque            ,sadness
3785,y pues bueno todo esto e muy complicado    ,sadness
3786,ya no quiero sangre            ,sadness
3787,paja irme dormir sola cuando hace estaba durmiendo con alguien,sadness
3788,necesito una segunda para ir          ,sadness
3789,ya estoy quedando sin            ,sadness
3790,no estudie nada pero pase un muy buen finde  ,joy
3791,otro hermoso domingo carreras risas y buena compania [?] en,joy
3792,extrano mi otro twitter            ,sadness
3793,un domingo sin resaca            ,joy
3794,ayer sali con mi amigo u senti 10 anos mas,joy
3795,alguien invite su casa ver maraton harry potter por favor,sadness
3796,amo el bardo en redes decirles pero facebook ya e,anger
3797,le mi novio un viaje disney despues terminar el bariloche,anger
3798,manana regreso oficina despues una semana vacaciones      ,joy
3799,buscar una casa para en y darte cuenta q e,joy
3800,ya se van por los metiendo el tema los meten,anger
3801,los cargo conciencia              ,sadness
3802,encanto el del dragon            ,joy
3803,lo demas se como quiera          ,joy
3804,necesito un masaje              ,sadness
3805,yo soy dijo el del iba ser y comi el,joy
3806,los sigo vuelta en instagram pasen sus      ,joy
3807,aun no se hacer para mi cumpleanos      ,sadness
3808,hoy no va creer lo bien piensa soy como nuestro,sadness
3809,dia ma lindo y yo aqui en mi casa  ,joy
3810,hoy se quienes estan mi lado en momentos dificiles  ,sadness
3811,ayyy los celos              ,anger
3812,no amiga somos do            ,sadness
3813,si bueno aunque despues estas ultimas muy mal lo tienen,sadness
3814,quiero despertar y sea septiembre          ,sadness
3815,queme con arriba rodilla y se puso bien feo eso,anger
3816,tan bien y yo no daba cuenta te deseo lo,sadness
3817,nunca en mi vida habia sentido tan otra persona  ,sadness
3818,y mi lo pide gritos  i sad    ,sadness
3819,hablame ser buena hija ante volver casa hoy pase por,joy
3820,nunca pense podia llegar este momento        ,sadness
3821,espero conseguir laburo asi arranco el curso con    ,anger
3822,estoy bien enojada alguien se comio mi nada    ,anger
3823,puneta ta ta              ,anger
3824,pero bueno                ,sadness
3825,bronca gente ve mi gata negra y dice ay susto,anger
3826,yo lo soy e su          ,joy
3827,senti mal y con tremenda ya esta      ,sadness
3828,esta felicidad tengo              ,joy
3829,sabado amp con mal humor          ,anger
3830,ya amigo                ,joy
3831,quiero mi                ,anger
3832,al pedo le conte            ,sadness
3833,seria lindo tener un proposito en vida alguna meta alguien,sadness
3834,? hay si se en mi hay y no cafe,joy
3835,? porque duele un chingo cuando alguien se va si,sadness
3836,pobrecito                  ,sadness
3837,tengo ansiedad mil              ,joy
3838,yo ya no voy ser tan mamona con los inviten,joy
3839,no se son peor si en villa o en  ,anger
3840,extranando ando                ,sadness
3841,otra noche mas sin poder dormir por lo veo y,sadness
3842,todo va seguir igual            ,anger
3843,hace 3 q te fuiste y no sabes lo mucho,sadness
3844,todo mg fotos mina noma lo unico asi e yo,sadness
3845,pesadilla tan mala              ,sadness
3846,hoy en el se dieron cuenta escribo bonito    ,joy
3847,banda o quiero para mi  se pasan do  ,joy
3848,pasa he gente salir por y dicen si y yo,joy
3849,ahora todos son fan d          ,anger
3850,quiero hacer algo              ,anger
3851,loco se merece lo mas lindo y lo mejor y,sadness
3852,jajajajajajaja vez siempre consigo lo quiero        ,joy
3853,oye como se cagaron al con palabra  wea porque,sadness
3854,qp con esa gente no deja vivir los demas o,anger
3855,tan cierto                ,sadness
3856,su ex                ,joy
3857,proximo capitulo aparecer los           ,sadness
3858,tremendo bajon                ,sadness
3859,como caga diga asi jaja y lo peor e lo,joy
3860,tan cierto duele              ,sadness
3861,odio ser mujer              ,sadness
3862,capaz estoy poniendo muy molesto          ,sadness
3863,espero todos en y zona hayan encontrado un lugar seguro,sadness
3864,gustaria poder pasar un buen finde eterno y no uno,anger
3865,final semana                ,joy
3866,esta pasando pero conmigo            ,sadness
3867,aun sigues extranando              ,sadness
3868,venia tan bien estos porque tuve sonar con el  ,sadness
3869,quiero un abrazo como el ayer        ,joy
3870,aqui bien feliz una pina no sabe pina    ,joy
3871,aburro mabel                ,sadness
3872,mereces lo                ,joy
3873,wn si uno en chile no da mas con los,sadness
3874,lo primero cuesta ya no          ,joy
3875,ya extrano mi casita con mi camita y mi  ,sadness
3876,vida solita se quienes son tus amigo y quien no,anger
3877,se puso celosa y encanto pero re toda veces donde,joy
3878,re queme  esta            ,anger
3879,esa mina                ,joy
3880,y pa                ,joy
3881,yo tambien di cuenta quienes valen pena      ,joy
3882,comentarios                  ,anger
3883,queda tan triste esquina sin          ,sadness
3884,ah trabajar                ,sadness
3885,bueno te dejen un sabado          ,sadness
3886,esta bien                ,sadness
3887,no sabia era tan dificil persona amas      ,sadness
3888,ganas ante te vayas            ,sadness
3889,los del iphone tienen harta          ,anger
3890,el dia                ,joy
3891,quiero un abrazo              ,sadness
3892,pequenas ganas salir              ,joy
3893,y por eso e no tomo con un ron para,sadness
3894,ya no quiero salir como en un      ,sadness
3895,esta semana creo su whats para no caer en tentacion,sadness
3896,una mejor amiga tire fotos asi        ,sadness
3897,todos preguntan por ti aqui en mi casa    ,sadness
3898,lastima q no quieras como          ,joy
3899,duele mas cuando sabes no puedes hacer nada por ella,sadness
3900,no encuentro manera              ,sadness
3901,ojala y soy el pinche hombre mas feo del mundo,sadness
3902,puneta                  ,anger
3903,paja crema post              ,anger
3904,porque tiene miedo da            ,sadness
3905,domingo mate y pelis            ,joy
3906,te haces tan linda            ,joy
3907,con quien queme un            ,joy
3908,hermoso dia                ,joy
3909,estoy despierta desde 6 am caga no poder dormir bien,sadness
3910,amaba los hoy ya no tanto        ,sadness
3911,pone triste hacer el super sola        ,sadness
3912,saca poca los              ,anger
3913,alguien para jugar al            ,sadness
3914,niego estar enfermo garganta hoy          ,anger
3915,vidal to barcelona              ,anger
3916,voy dormir devuelta              ,joy
3917,ultimo trabajo del viejito toda madrugada  sin dormir  ,sadness
3918,da una bronca cuando contesta asi wacho      ,anger
3919,bravo se le acaba buena vida        ,anger
3920,escuche cancion manuel y no creo pueda volver escuchar algo,sadness
3921,como todos los domingo con dj        ,joy
3922,y aca va nuevo            ,joy
3923,llega el padre mi novio pero dijo el nombre ex,anger
3924,salir fiesta y perderme sabado felices jamas      ,joy
3925,y pesar tantas aun sigo ahi        ,sadness
3926,tengo boca toda literal            ,anger
3927,espero estas no              ,sadness
3928,si ver con toda su grupo menos con pero con,joy
3929,no entiendo pq rocio se le ocurre cuando mas necesito,joy
3930,te odio nunca llegaron mi          ,anger
3931,este dia ha sido el dia mas toda mi vida,sadness
3932,el dia puedo dormir un poco mas no puedo dormirme,anger
3933,toda noche  ganas cama no        ,anger
3934,estoy preocupada por              ,sadness
3935,estoy en un y una nina no se deja mover,anger
3936,porque entonces ya no seria laacademia seria otro programa  ,joy
3937,no llego tiempo para verlo          ,sadness
3938,mi papas tenian razon deberia haber mi casa y no,sadness
3939,un domingo muy lindo            ,joy
3940,esto                  ,anger
3941,e el unico lo dice por solo conoce el pasado,joy
3942,se acaba el partido y lleva 6 6    ,joy
3943,echar menos parece super bonito pero cono yo quiero estar,sadness
3944,voy dormir sin nadie mande una nude      ,sadness
3945,estaria necesitando unos buenos masajes          ,anger
3946,como no pasa eso con          ,sadness
3947,hizo despertar esta hora            ,joy
3948,no dormi nada nuevo            ,anger
3949,verguenza                  ,anger
3950,sirve ser guapo si mujeres solo se en los sentimientos,sadness
3951,nunca puede terminar noche bien nunca        ,anger
3952,desaparecer en un abrazo ya ahora        ,sadness
3953,todo el finde junto y hoy no duerme conmigo ya,sadness
3954,? por pasan estas cosas          ,anger
3955,quiero ser una estrella en donde el acuerdo    ,sadness
3956,buenos dias  feliz domingo          ,joy
3957,dieron muchas ganas ir por mi guitarra y tocar pero,sadness
3958,levante 7 manana para llegar facu y el profe llegue,joy
3959,sinceramente espero le den por el orto      ,joy
3960,estuve paseo y todo el tiempo pense en ella creo,sadness
3961,sorprende como todo lo saben desde su hogar    ,joy
3962,echo menos mi              ,sadness
3963,un good aunque sea            ,joy
3964,mi novio no responde y asi        ,anger
3965,duele cabeza                ,sadness
3966,encanta compartir meme y no lo voy dejar hacer hasta,sadness
3967,ganas ir one              ,sadness
3968,? realmente e necesario tirar algo al suelo calle cuando,anger
3969,hombre dejen con esas ninas para y luego no sean,anger
3970,no funciona mi twitter  e el unico lugar paz,sadness
3971,como caga no si esta en linea      ,anger
3972,se sigue igual              ,sadness
3973,hace luz q no contesta          ,anger
3974,fea noche pase              ,sadness
3975,ganas netflix y un helado          ,joy
3976,te hablo y despues no rabia        ,anger
3977,feo bajon dio              ,sadness
3978,tiene ma vidas un gato          ,sadness
3979,manana va ser domingo puro  como lo el y,joy
3980,una vez mas lo mismo          ,sadness
3981,lo alguien un sabado noche          ,sadness
3982,dia tan hermoso para estar al solcito      ,joy
3983,buena tarde en el parque fue        ,joy
3984,esto e por mas por mi        ,joy
3985,ante te hoy ni siquiera te una en    ,sadness
3986,no quiero ir mty            ,sadness
3987,hace no unas y si ya perdi el toque  ,sadness
3988,uh lo voy matar            ,anger
3989,por favor dios duerma y despierte en en un [?],sadness
3990,aparece yo asi no puedo  estudiar ahre    ,sadness
3991,pone contenta ver sus alegria y felicidad      ,sadness
3992,esperar y medium              ,anger
3993,y no entiendo esa saca con estar contando todo el,anger
3994,tremenda propuesta lastima avisa ultimo momento        ,anger
3995,el aire acondicionado no tenia otro momento para    ,sadness
3996,"ayer mi mama se y dijo al oido "" estoy",joy
3997,estupido hace despertar mi ansiedad si e un concierto en,sadness
3998,muchas cosas si deberian darse por obra del santo  ,joy
3999,todo e risa y felicidad en fiesta hasta te tienes,joy
4000,quede dormido unas 4 veces y desperte 5 minutos despues,joy
4001,yo queria poner diadelnino tuits o muerte otros ninos pero,sadness
4002,no puedo creer guste tanto          ,sadness
4003,tanta veces lo vi gusta cada f ma lo voy,joy
4004,el sugar mi amiga dejo en casa y mi vecina,sadness
4005,y aqui e donde te da cuenta quienes si y,joy
4006,se olvido y se fue dormir ante      ,joy
4007,le rt o no como quiera va salir  se,joy
4008,persona mas amas en vida deberian ser      ,sadness
4009,voy dormir                ,sadness
4010,? como fue enferme super dlv en literal 1 hora,sadness
4011,quiero pase ya manana            ,sadness
4012,manejo una ansiedad quiero ma o nose      ,anger
4013,poca madre lluvia apenas llegue mi casa      ,anger
4014,? alguien haga un masaje en los pie    ,joy
4015,ojala hubiera jugado el            ,sadness
4016,maldita resaca no deja un en paz      ,sadness
4017,necesito muchos                ,sadness
4018,necesito un                ,sadness
4019,asi mi corazon los hijos su pinche madre    ,joy
4020,aparte ser un amor e un gay icon quien mas,sadness
4021,yo tambien ya el video          ,joy
4022,como te voy extranar            ,sadness
4023,do    dia 25   casa  ,joy
4024,tengo unas ojeras bien horribles gracias insomnio      ,sadness
4025,en el los un video un traje bano roto y,joy
4026,ya no estoy segura nada          ,sadness
4027,esta jugando el milan contra el digo barca bueno esa,sadness
4028,alguien lo entiende              ,joy
4029,hice un mini corte en el dedo y cuando fui,joy
4030,en momento se acabo el fin semana      ,sadness
4031,justicia para todos los por el facil      ,sadness
4032,va terminar por al final          ,joy
4033,q lindo dia para todo en universidad      ,sadness
4034,el estres y ansiedad estoy manejando x los finale e,sadness
4035,yo veo video mi familia todos junto compartiendo y yo,sadness
4036,e un sentimiento muy terrible el llegar casa una tia,sadness
4037,hace tiempo no estos tan feos        ,sadness
4038,estoy y ni un encuentro          ,joy
4039,debi haberme ido cuando quedarme esperando algo no seguro  ,sadness
4040,un rato                ,joy
4041,sera siempre tiene razon pero nunca escucho      ,sadness
4042,e tan corto el amor y tan largo el olvido,sadness
4043,feo terminando noche en guardia          ,sadness
4044,instagram gracias por no absolutamente nada calle y    ,anger
4045,por si llegas leer te extrano mucho      ,sadness
4046,tenes con un gran viene hacer un buen partido y,anger
4047,yo tambien quiero en feria santa cruz      ,sadness
4048,para el orto anda mi celular        ,anger
4049,no existir los              ,anger
4050, manana sera un dia full trabajo      ,joy
4051,hola estoy buscando amigo nuevos quieran hablar conmigo    ,joy
4052,realmente molesta esas cuentas estan en privado no puedo ni,anger
4053,mi amigo necesitan pasar al menos un en costa porque,anger
4054,alguien con iphone 7 tambien se le quito chiquita en,sadness
4055,o ya                ,sadness
4056,dios no queria sufriendo            ,sadness
4057,como vos siento tu odio en like en lo contra,sadness
4058,gana                  ,joy
4059,uy como asi ya amanecio          ,sadness
4060,tienen los perros en contra mio como duele el pie,sadness
4061,cada vez recuerdo este entro 700        ,joy
4062,bueno fui hasta lo nacho al xq estoy vuelta aca,joy
4063,desesperacion se borro todo del celular        ,anger
4064,vi esto y senti como si m estuviera metiendo mi,joy
4065,tremendo mal humor tengo            ,anger
4066,merli te extrano              ,sadness
4067,asi e tienen quedar            ,joy
4068,nuevo con esto amigo espero su maximo apoyo da rt,joy
4069,no gato   jajaja          ,joy
4070,usted no da ni lastima          ,sadness
4071,no hay nada mejor te gusta te historias ig  ,joy
4072,"deje mi celular "" "" toda noche y hasta ahora",joy
4073,con 30 anos en mitad EUR  EUR para discutir,sadness
4074,puedo estar peor no sirvo nada        ,sadness
4075,no he dormido bien no he comido bien y ni,joy
4076,se fue luz y yo sin bateria      ,joy
4077,hola segundo dia  sensacion tener un en cintura empiece,joy
4078,ver cerebro ? gusta o no no gusta ya no,anger
4079,feo no lo mismo vos          ,sadness
4080,idea                  ,sadness
4081,lindo esta el parque            ,joy
4082,estoy mal humor si muy          ,joy
4083,yo no                ,anger
4084,siempre hay                ,joy
4085,tremenda noche                ,joy
4086,pinto maraton hp nomas            ,joy
4087,pasar por por plata y viera asi  nose haria,sadness
4088,somos quien no sin            ,joy
4089,manana va ser tarde y demasiado tarde      ,joy
4090,maraton con v              ,joy
4091,no gusta sentirme asi            ,sadness
4092,primero mexicana ahora version girl  ya dejen y algo,anger
4093,esta ma claro quien e          ,joy
4094,hoy desperte y en lugar desayunar y tomar cafe tome,joy
4095,todavia tengo                ,joy
4096,no entiendo mi por tomar si siempre siento bien mal,sadness
4097,llevo 8 horas vacaciones y ya estoy aburrido    ,sadness
4098,te amo                ,sadness
4099,acaban mi forma              ,joy
4100,estoy re mal              ,sadness
4101,el del celular podra toda faltas ortografia pero nunca con,sadness
4102,saludo quien da gana  jaja        ,anger
4103,q manera extranarte              ,sadness
4104,y  ! buenos dias          ,joy
4105,admito si algo quedo aca encanta capital     ,joy
4106,bebe  feliz estes bien          ,joy
4107,quiero meterme un en el ojo        ,joy
4108,hace falta luis miguel serie          ,sadness
