,text,label
7163,tengo unas ganas hacer un curso        ,joy
7164,ojala algun dia pase bien mi cumpleanos      ,sadness
7165,bien hace un poco love esta hora      ,joy
7166,porque le en el            ,anger
7167,lpm duele todo              ,anger
7168,? como ya manana e lunes        ,sadness
7169,dormi mal                ,sadness
7170,eso tener dona en casa no esta nada bien ,sadness
7171,extrano                  ,sadness
7172,felices aquellos se gustan y se tienen      ,joy
7173,preciosa imagen  gracias por amigo        ,joy
7174,quiero                  ,joy
7175,para seguir contra corriente no tiene caso      ,sadness
7176,quien salio  laacademia            ,sadness
7177,lo primero le dije y lo primero hace    ,anger
7178,hoy estoy con todo el mundo        ,joy
7179,mal humor                ,anger
7180,no puedo seguir con estos          ,sadness
7181,perdi o numero              ,anger
7182,los 2 huevos como            ,anger
7183,embole no hablar con nadie          ,sadness
7184,adoro los pantalones campana            ,joy
7185,cancion super caga y mi querida vecina ya puso 3,anger
7186,mi papa hoy dijo fuera muy feliz lo no sabe,joy
7187,tengo ir pa ' y no encuentro ninguna    ,sadness
7188,eres como los taco venden en calle estas super pero,sadness
7189,noches feas y mia esta noche        ,sadness
7190,? porque gasto tanto dinero en        ,sadness
7191,siempre lo mismo yo y los        ,anger
7192,necesito mate en el sol y compania      ,sadness
7193,quien pregunte si he ido fiesta le voy decir si,anger
7194,e una frase muy buena julio y tambien e una,joy
7195,quiero q mi profe suba notas        ,sadness
7196,luego no si le sigue un poquito vista    ,sadness
7197,sabes nicolas no te creo nada        ,anger
7198,? alguna vez han llorando sin razon      ,sadness
7199,ire ver una pelicula terror tal vez no duerma esta,joy
7200,malditos trauma amor              ,sadness
7201,bienvenida al club              ,sadness
7202,""" hizo dano pero tambien hizo feliz "" -- yo",sadness
7203,ganas un novio              ,sadness
7204,perdon pero no era para esa joda      ,sadness
7205,tome un chela con el del centro una buena noche,joy
7206,cuando una persona esta podrida por dentro jamas va cambiar,joy
7207,falte una clase doble            ,joy
7208,quiero con                ,sadness
7209,manana mi hermana entra prepa y duele ya no sea,sadness
7210,como odio ser asi ganas pegarme        ,anger
7211,ando bien sad              ,sadness
7212,queres te diga cada vez muere un policia alegro situacion,joy
7213,e un caso              ,joy
7214,vamos el amanecer en carretera          ,joy
7215,o en general ira mal          ,sadness
7216,no dura nada el fin semana        ,sadness
7217,creo no vino fer            ,sadness
7218,mi noches serian perfecta si estuvieras conmigo      ,sadness
7219,mi novio se corto el cabello y siento triste por,sadness
7220,cuando preguntan mi nombre digo y terminan diciendo    ,sadness
7221,ptm estoy lleva vrg            ,anger
7222,nadie entiende                ,sadness
7223,tengo ganas salir pero no hay con quien    ,joy
7224,asi e                ,joy
7225,vamos                  ,joy
7226,quiero seguir durmiendo  no le pasa      ,sadness
7227,ma cara                ,anger
7228,parece demasiado injusto yo muero por tener un perrito y,anger
7229,n dormir por causa do calor        ,anger
7230,un abrazo solo eso necesito          ,sadness
7231,abro instagram y estan todos viaje o comiendo sushi  ,sadness
7232,yo con mi crush            ,sadness
7233,volve ya                ,sadness
7234,wow como gusta ver mujeres jugando  buen dia gente,joy
7235,creo los entre pablo lopez y y los veremos en,joy
7236,quiero llorar mucho pq no estas aqui conmigo    ,sadness
7237,si estoy celosa y            ,anger
7238,amigo estoy en mi curso matematicas del y le juro,sadness
7239,venia todos los domingo comer casa        ,sadness
7240,en una tienda del tienen un 4 partido al medio,sadness
7241,por no con una nota          ,anger
7242,buenos dias y viaje hoy no volvemos      ,sadness
7243,pronto le mi feliz semana luna llena      ,joy
7244,no puedo sentir tan mal          ,sadness
7245,no se si ver el ultimo episodio the original  ,sadness
7246,acordar nunca tener hijos con tener cuidar mi hermanas 247,anger
7247,siempre sera un gran clasico viendo sus peliculas hoy una,joy
7248,nunca pense decirlo pero extrano mi trabajo      ,sadness
7249,mate con papa              ,joy
7250,ay                  ,anger
7251,ya quiero verte  muy pronto        ,joy
7252,cuesta tanto soltar              ,anger
7253,estaba todo re lindo y hoy siento le hago mal,sadness
7254,pa                  ,joy
7255,pinche yo ya habia tentacion helado bombon      ,joy
7256,lo lindo saber hacia donde va e te chupa un,joy
7257,el finde mas queria estar en casa toca estar afuera,sadness
7258,quiero ir un taller algo para poder mi tiempo libre,sadness
7259,te extrano demasiado              ,sadness
7260,quiero hacer algo hoy pero no tengo compania    ,sadness
7261,medio dia ya y no he hecho nada en el,sadness
7262,nada mas bonito entrar hasta el 27      ,joy
7263,casi no pude dormir  odio ser asi    ,sadness
7264,tanto cuesta ponerse los pantalones y decir verdad    ,anger
7265,odio el horario visitas con todo mi ser    ,anger
7266,no te no esperanza no te gracias dios mio por,sadness
7267,parte el corazon pero cada uno sabe lo hace  ,sadness
7268,dormir con e lo hago          ,sadness
7269,estoy muriendo por poder            ,sadness
7270,pero esta no deja            ,sadness
7271,verdad gracias vida no puedo creer lo q paso sinceramente,joy
7272,buenas                  ,joy
7273,flores jamas moda              ,joy
7274,esperando princesa                ,anger
7275,hoy dia nadie ni han puesto fotos mias y los,anger
7276,ay abuelo                ,sadness
7277,quien levanta                ,sadness
7278,en unica mujer q confio e en      ,anger
7279,el dolor espalda esta matando lpm        ,sadness
7280,no estoy triste porque manana e lunes pero estoy vacaciones,sadness
7281,espero los ninos nunca se olviden mi      ,sadness
7282,te pone los auriculare y te habla hasta el perro,anger
7283,asco carretera para llegar            ,anger
7284,el mejor no no dara mas clases era el unico,sadness
7285,estoy entre hacer una torta uno e cuestion    ,joy
7286,"estoy viendo "" "" mientras almuerzo        ",joy
7287,dormir otro ratito              ,joy
7288,felicidad manejo cuando mi mama veo bien saca lo mejor,joy
7289,queda una semana vacaciones y e desde estoy en no,anger
7290,ante 18 en mil y pico nada mas    ,sadness
7291,entro 4am no se si dormir o quedarme asi  ,joy
7292,mama queres                ,anger
7293,no queria yo              ,sadness
7294,ya frio pa dormir solo          ,sadness
7295,hice queso y una torta chocolate estoy para irme vivir,joy
7296,los domingo e el unico dia puedo dormir hasta tarde,joy
7297,tapia le con los cambios hay q ir buscar los,anger
7298,no entiendo por mejor y esta parada      ,joy
7299,malditos fuera                ,anger
7300,gran inicio semestre              ,sadness
7301,quiero                  ,sadness
7302,jamas se hizo ir uno          ,sadness
7303,tengo ganas escuchar mario luis          ,joy
7304,voy matar mi hermana            ,anger
7305,vida esa manera              ,anger
7306,como cuando tus amigo dejan sus cumpleanos porque toda maneras,sadness
7307,vamos tener ir dar unas vueltas        ,joy
7308,encanta saber verdad y preguntando para ver hasta donde llegan,joy
7309,hoy tambien amo              ,sadness
7310,cagas vida pinche tigres            ,anger
7311,solo quisiera                ,sadness
7312,por tiene ser tan dificil          ,sadness
7313,como un completo extrano            ,sadness
7314,no hay nada odie ma estar esperando saca poca q,anger
7315,quedo con lo bueno despues todo        ,sadness
7316,como odio quede olor en ropa y en el pelo,anger
7317,rico ayer enserio hace mucho no pasaba ya genial  ,joy
7318,ojala se pudiera mandar en lo sientes ojala gente ojala,sadness
7319,si lo un hasta por favor        ,sadness
7320,apenas esta cayendo el todo lo paso en 2 semanas,joy
7321,soy tu hermana mayor            ,joy
7322,yo tambien tengo mi favorito solo se rodilla y ya,sadness
7323,el una vez mas siempre un        ,sadness
7324,no hay pedo si noma quieren jugar el pedo e,anger
7325,una dosis mimos mi novia pero ya      ,sadness
7326,tengo una y tengo ir trabajar asi      ,joy
7327,aun falta como medium hora          ,sadness
7328,del futuro cuando el wey te guste e distinto los,joy
7329,cuando pienso cosas no ser peor        ,sadness
7330,estoy viendo y mi cabeza esta explota osea quien e,anger
7331,lo unico                ,sadness
7332,quisiera estar 5 anos ante          ,sadness
7333,ganas quedarme acostada              ,sadness
7334,no estoy lista para regresar realidad        ,joy
7335,un re viaje en no le da para dormir no,anger
7336,tengo do dias para lograr ir        ,sadness
7337,incomodo jajajaja quiero ya se cuenta        ,joy
7338,y todavia falta lo mejor          ,joy
7339,hubiera ido para agua o hoy        ,sadness
7340,dia no espera hoy buenos dias        ,joy
7341,estupido nudo en garganta            ,sadness
7342,e todo lo quiero no necesito mas      ,joy
7343,buenos dias tenga todos un excelente miercoles      ,joy
7344,haces el dia              ,joy
7345,solo hasta el martes y solo tengo como    ,joy
7346,mi mama y su llevarme fiesta yo no quiero ir,joy
7347,no decir si estais bajon o quereis ver cosas bonitas,joy
7348,estoy muy feliz porque ya casi tengo mi semana vacaciones,joy
7349,dios mio                ,sadness
7350,cada vez estoy mal del higado como ahora antojo comer,anger
7351,como duele ver mi sobrino asi        ,sadness
7352,ya no quiero ser un desastre        ,sadness
7353,suerte en                ,joy
7354,ya pensando en toda semana tengo levantarme      ,sadness
7355,y despues mientras              ,anger
7356,mi sabado sin salir mucho netflix pizza y con  ,joy
7357,se hacen malas y despues hacen estas      ,anger
7358,mi los no usan los          ,anger
7359,manana mi familia se va viaje asique si alguien quiere,joy
7360,siempre                  ,joy
7361,vida y ya no quiero una nueva      ,sadness
7362,tan buen trato parecia raro ya feo sea asi  ,sadness
7363,mi cel nuevo y ya no vale do por soy,sadness
7364,tener unos zapatos te gustan mucho pero por mas los,anger
7365,onda gente dice queda mal una foto propia fondo bloqueo,sadness
7366,donde quedo                ,anger
7367,este internet cada rato falla         ,anger
7368,vos tenes tiempo para verme mi lu siempre maldita  ,sadness
7369,bueno esta bien no 5 segundos pero si 10  ,joy
7370,vida desde                ,joy
7371,gente habla sin una pina cada una      ,anger
7372,veces tomar distancia ciertas persona hace bien      ,joy
7373,esto hizo poner mal humor          ,anger
7374,nada hace mejor ver cosas sobre este chico y ya,joy
7375,no mamen                ,anger
7376,juro ver mi abuela cada vez peor se todo  ,sadness
7377,mi                  ,sadness
7378,felizsabado porque aunque sea un dia nublado vale pena vivir,joy
7379,peor no puedo estar            ,sadness
7380,ahora acorde porque no hacia esto noche      ,anger
7381,lo mas dificil e descubrir tu crush esta    ,sadness
7382,ya empezo mi celular            ,sadness
7383,dormi seguidas                ,joy
7384,bronca siempre termina mal soy yo        ,sadness
7385,el oficial grito al piso yo lo tenia en el,joy
7386,su y se quede su perfume por mi    ,sadness
7387,momento tu arena entre todos lo mejor      ,joy
7388,no                  ,sadness
7389,pues q jodan le voy hacer        ,joy
7390,cosa divina salir el bondi un domingo bien y pase,joy
7391,triste noticia                ,sadness
7392,ya pasaron ? por sigo sintiendo como el primer dia,anger
7393,mi novio hizo cenar para los do y pues comi,sadness
7394,madre dios bendito              ,anger
7395,ganas poder respirar por nariz  da hasta bronca ya,sadness
7396,so                  ,sadness
7397,se paso volando el finde          ,sadness
7398,mi bajon hoy ya e mundial        ,sadness
7399,donde pongo                ,sadness
7400,voy tener ver el partido del por stream    ,anger
7401,alarma en 10 min  se acabo vida buena  ,sadness
7402,dificil e fuerte              ,sadness
7403,ganas con                ,sadness
7404,sea asi                ,anger
7405,cansancio                  ,sadness
7406,nosotros                  ,joy
7407,tengo en el oido ? alguien ensene el lenguaje  ,sadness
7408,con novia                ,joy
7409,cuando dije ya bien y bonito como siempre no todo,anger
7410,llore todo el dia            ,sadness
7411,tengo estar asi              ,sadness
7412,2 veces y do fueron chicas        ,sadness
7413,4 veces en el ano tanta gente hay en este,anger
7414,estoy triste                ,sadness
7415,muy linda y todo pero cuando uno esta    ,sadness
7416,llegue el 20 por favor          ,sadness
7417,todo le molesta              ,anger
7418,no se espera manana en facu pero ya basta destino,sadness
7419,gracias y por los            ,anger
7420,nueve  kcamexico nohaynadiemas sebastianyatra apartirdehoy        ,joy
7421,enserio re extrano              ,sadness
7422,no lo volvere hacer            ,anger
7423,yo queria ir              ,sadness
7424,ultima vez mi papa fue no mando unas  quiero,joy
7425,pedi y dieron un pedazo milanesa pollo estaria extranando carne,sadness
7426,no le creo q este trabajos        ,anger
7427,mi anda haciendo raros ni se te  tengo subir,anger
7428,bonita sorpresa saliendo del estadio azul        ,joy
7429,ganas un tren  son muchas        ,joy
7430,e un placer  tenerte como amigo -- amistad  ,joy
7431,no tengo platica en mi soy yo      ,joy
7432,no puedo evitar sentirme culpable          ,sadness
7433,intente evitar sentir nada y termine todo      ,anger
7434,uno sufre por              ,sadness
7435,tendria cambiar con este tema pero re molesta    ,sadness
7436,sad chabon                ,sadness
7437,duele todo                ,sadness
7438,no quiero acabe este ciclo          ,sadness
7439,cuandotepiensosiento te sigo en todo          ,sadness
7440,do  y we            ,sadness
7441,lindos los domingo sin resaca          ,joy
7442,siento como hubiera pasado un camion encima asi e este,sadness
7443,ya tengo hambre              ,anger
7444,al nene tanto concierto se le esta jodiendo garganta ,sadness
7445,manana deberia ser festivo para todos no solo para mi,sadness
7446,como cuida el              ,joy
7447,esta noche vamos un porque aqui no va poder dormir,sadness
7448,! buenos dias y los esperamos en plaza cancun  ,joy
7449,si pelicula esta en espanol para na no f no,anger
7450,quiero llorar del coraje            ,sadness
7451,lindo el carino gente muy          ,joy
7452,vamos                  ,sadness
7453,paso todo el mundo            ,sadness
7454,quiero parar con esto            ,sadness
7455,hice un meme mi misma y lo subi historia ig,anger
7456,siempre voy meter banar se mete otro loco sere mas,anger
7457,con piel                ,joy
7458,siento tan cansada              ,sadness
7459,el unico levantado en esta casa        ,anger
7460,el amigo esta primero            ,joy
7461,no tomamos 2 birras en unas pares vueltas y ahora,joy
7462, neta no vean e una mamada e como si,anger
7463,lindo domingo                ,joy
7464,caga algo se e            ,joy
7465,podria levantar pero no hay ganas        ,anger
7466,por tenian aparecer por tenia acabar por ya no sientes,sadness
7467,un par  con este resfrio        ,sadness
7468,yo no como hace para dormir tanto      ,sadness
7469,fav arriba y hacemos 1 por of      ,joy
7470,10 anos tiene mi hermana y una caja un nene,anger
7471,le mande ft q mi vieja ropa q quiero y,anger
7472,unica persona realmente importa en cancun no contesta y estoy,sadness
7473,si no en una con un una cerveza y buena,joy
7474,menudo                  ,anger
7475,amigo tengo un problema            ,joy
7476,hoy ha una manera wow          ,joy
7477,lo mas lindo vida e compartir en familia  soy,joy
7478,felicidad ahi tienen nada            ,joy
7479,mal humor todos o dia          ,anger
7480,mi dormir 4 am para despertarse 6 am e ir,sadness
7481,estoy tan celosa red y  ojala tambien tuviera y,sadness
7482,gracias todos                ,joy
7483,no digan q llueve pelotudos xq creo      ,sadness
7484,al final no se hizo fiesta        ,sadness
7485,recuerden momentos malos tenemos todos no del momento    ,sadness
7486,estupida quiero muchisimo              ,joy
7487,tengo una nueva y esta chido lo unico malo e,anger
7488,duele panza por los del viernes y trato el dolor,joy
7489,ya esta of en netflix y nadie aviso    ,sadness
7490,esta tristeza tengo no saca nadie        ,sadness
7491,no dejes pasar el tiempo esperando cosas mejores    ,joy
7492,estamos igual                ,sadness
7493,como un te puede joder existencia estudiando      ,anger
7494,tuve tan buen sabado pense era domingo      ,joy
7495,tambien quiero ver san            ,sadness
7496,hoy e esas pocas noches en cual quedo queria tomar,sadness
7497,no hay cosa mas aburrida estar un fin semana sola,joy
7498,ya desayune estoy viendo los ahora        ,joy
7499,ya da igual estar soltera puedo ser feliz asi solita,joy
7500,giles son los aca loco tienen        ,anger
7501,cuando quito mi foto wa no e por e porque,joy
7502,miedo tengo                ,sadness
7503,estoy buscando fotos novios para y no e porque este,joy
7504,como asi q ya amanecio          ,sadness
7505,e mandando foto do ah como queria      ,sadness
7506,sigo sin creer ya no estare en escuela con mi,sadness
7507,yo necesito mi mejor amigo llegue puerto rico    ,sadness
7508,bien se siente matar al te estaba      ,anger
7509,hoy mismo lo termino porque entro el lunes y no,sadness
7510,ni una buena noticia            ,sadness
7511,tengo entrada y si puedo ir por tema trabajo quiero,sadness
7512,odio ponerme y se pegue el cabello los labios  ,joy
7513,e mejor sonreir llorar            ,joy
7514,yo en realidad solo queria una novia y super feliz,anger
7515,"toda una escribiendo "" "" sin h bien dicen un",sadness
7516,si estuvieras aca              ,sadness
7517,6 llevo 0              ,sadness
7518,no se acabe el dia por favor      ,sadness
7519,llegue cerca 4 ya estaba en en clinica linda noche,sadness
7520,ultima fue hace 12 anos y yo no nada vez,sadness
7521,como necesito el ultimo momento con  nervios    ,sadness
7522,ojala                  ,sadness
7523,en nuestro pais  se y por opciones tenemos para,anger
7524,duermo mismas horas y trabajo el doble horas duermo no,sadness
7525,siempre hay una persona sabe como el corazon    ,sadness
7526,olvide te vine buscar y al contigo no dar encanto,sadness
7527,se mi ojitos no misma manera        ,sadness
7528,alguien quiere invitar comer hoy          ,joy
7529,tengo un nudo re feo unas ganas llorar  nose,sadness
7530,en serio ese fue mi peor error y siempre voy,sadness
7531,cago del miedo              ,joy
7532,mi novio e ese dice se va dormir y los,joy
7533,hoy toca ser feliz con mi        ,joy
7534,manana por suerte se nuevo          ,joy
7535,mientras el fandom se pelea con no se quien yo,joy
7536,hoy mas nunca entiendo mi mama lo son cosas vida,sadness
7537,porque tienen ser tan cosas          ,sadness
7538,mejor voy dormir              ,anger
7539,! bueno no lo hice          ,sadness
7540,creo nada lo haga va salir bien      ,sadness
7541,y capaz en por calle viste y podes decir todo,joy
7542,no puede ser un mg ponga asi lpm    ,anger
7543,yo muero por              ,sadness
7544,facu no presta nada  lo peor e q no,anger
7545,si contesta ni enojo igual          ,joy
7546,hoy si se salio lagrima cuando mi papas    ,sadness
7547,hermosa gente amable              ,joy
7548,! tenemos los              ,joy
7549,muchas gracias                ,joy
7550,colombia donde ninguno mi favoritos han hecho concierto    ,sadness
7551,ok solo quedan hr vacaciones          ,sadness
7552,en se mi amiga            ,sadness
7553,no he whatsapp desde ayer y e bien rico  ,joy
7554,sabes ya eres una senora cuando te sin despertador  ,sadness
7555,por una materia              ,anger
7556,facil hacia esta mal            ,anger
7557,y '                ,joy
7558,e bueno  conocer [?]          ,joy
7559,el instagram el telefono una nueva        ,anger
7560,no no                ,joy
7561,tengo tantas ganas casarme            ,sadness
7562,no se si sea una pendejada pero acabo comprar youtube,sadness
7563,se termino el dia            ,joy
7564,chica como una basura cuando hay ma gente    ,anger
7565,para existen nunca tienen auto          ,anger
7566,ya van empezar vuelta con luz hijos mil    ,anger
7567,no habia dado cuenta este era el      ,sadness
7568,quien quiera estar este asi simple        ,joy
7569,por eres asi              ,sadness
7570,nadie dijo seria facil            ,sadness
7571,no carga ninguna historia ni imagen nada  en cualquier,anger
7572,yo sin ganas enamorarme y tu vienes y    ,sadness
7573,mi consejo para tener exito haber sido      ,joy
7574,parte el alma              ,sadness
7575,lo en el carro al oido        ,sadness
7576,lleva ala y su hijo lo deja solo peleando con,joy
7577,por amor he y mi sentimientos        ,joy
7578,odio digan                ,anger
7579,mal ahi re baja q siempre cosas malas nunca pero,sadness
7580,eres el mejor amigo cualquier por un precio pero no,joy
7581,y eso e algo lo diario rabia weon    ,anger
7582,cm mi cintura y dia como hoy esta cm  ,anger
7583,re duele cabeza              ,sadness
7584,lo malo vivir en santiago          ,sadness
7585,quiero pensar no soy tan mamona o tan fea  ,sadness
7586,hoy pare no to            ,joy
7587,! caga                ,anger
7588,y se re mal           ,anger
7589,nueva musica perra              ,sadness
7590,estan ganando                ,sadness
7591,manana mi novio regresa clases y yo no    ,sadness
7592,se fueron todos y dejaron re        ,sadness
7593,debe ser termine con garganta          ,sadness
7594,perdon                  ,sadness
7595,los no tienen el deben hacer para      ,anger
7596,para el  cada ano te odio ma    ,anger
7597,y bue fue una linda noche        ,joy
7598,se acabo                ,joy
7599,"wa my diciendome cuando agarre los "" para quieres un",joy
7600,siento en cualquier momento quedare dormida en el trabajo  ,sadness
7601,esto e un arte            ,sadness
7602,dios dame paciencia              ,joy
7603,ha ese                ,joy
7604,hace 3 anos copa libertadores          ,sadness
7605,y el 7 tambien            ,joy
7606,estaria necesitando pasen rapido los dias        ,sadness
7607,ya estoy del hpta            ,anger
7608,solo 5 dias nada mas 5 dias para volver verte,joy
7609,creo cuando vacaciones recien vamos tener notas      ,anger
7610,necesito fotos nuevas hace mil no saco      ,sadness
7611,siento luego esto volvere super man  hasta llegue alguien,sadness
7612,mujeres nunca d hacer cosas fuerza x eso niego lavar,sadness
7613,como seria nuestra relacion si hasta hoy      ,sadness
7614,venezuela sin una para            ,sadness
7615,ya mi vecino con sus y amp todos los dias,anger
7616,todo estaba bien pero se dio cuenta no era asi,joy
7617,peliculas porfa                ,joy
7618,uno mi grandes gustan guapos          ,sadness
7619,este hilo sobre              ,sadness
7620,necesito en mi vida            ,sadness
7621,le el regalo del dia del nino mi hermana y,joy
7622,lo mas extrano ir al e ver su hermosa sonrisa,sadness
7623,despues y medio 3 dias no son suficientes    ,sadness
7624,siempre digo voy salir joda mi tio da plata para,joy
7625,como no voy enfermar con estos cambios tan clima  ,anger
7626,ya quiero sea mi cumple          ,joy
7627,aburrimiento y no hablo con nadie        ,sadness
7628,triste ya no por series          ,sadness
7629,odio los mitad los video en facebook y youtube  ,anger
7630,sacaron lo mejor canto hoy en laacademia      ,anger
7631,dia 5 sin sueldo y sin ti      ,sadness
7632,twitter se usa en modo          ,anger
7633,ganas salir pero no facu no        ,joy
7634,fotos no son mas            ,joy
7635,descargue 4 capitulos mi serie abuela para llegar casa y,joy
7636,saber no puede pasar cualquiera nosotras no e justo vivir,sadness
7637,lpm te y lo primero f son y mi familia,anger
7638,gato del orto dsp tiene cara para cosas    ,anger
7639,preocupa no salgan entradas para el 1      ,anger
7640,asi cm vamos 3 tarde vamos terminar      ,anger
7641,cada vez dan mas asco feminista  vengan mil  ,anger
7642,ojala esa fuera mi e          ,sadness
7643,no fui trabajar lloro            ,sadness
7644,ni eso estoy trabajando            ,anger
7645,buenos dias y arrancamos laburar          ,joy
7646,estoy y aun asi sali          ,sadness
7647,despierta con el mejor abrazo del mundo  [?]  ,joy
7648,q frio                ,sadness
7649,unos mate y limpiar casa          ,joy
7650,extrano mi vida hace 3 anos        ,sadness
7651,odio detesto q cosas sin permiso        ,anger
7652,mty                  ,joy
7653,! ay                ,joy
7654,nunca pense fuera asi            ,joy
7655,posta dejo mi dignidad aca en twit por el  ,sadness
7656,arrepiento no haber traido almohada          ,sadness
7657,extrano mi casa mi cama mi todo sea manana para,sadness
7658,llega y andres x nada  quiero morir    ,joy
7659,sigo con una bronca            ,anger
7660,ya estoy acostada peli            ,joy
7661,ya estoy re cansada esto          ,sadness
7662,o se le ocurre trabajar un domingo en manana  ,anger
7663,lo mas lindo semana e vuelve libertadores      ,joy
7664,otra vez con sueno            ,sadness
7665,todo mal hago              ,sadness
7666,papa te estas pasando vrg          ,sadness
7667,triste e cuando llegas directamente un viaje      ,sadness
7668,gusta el humor politico            ,joy
7669,tarde juego                ,joy
7670,estan han sido peores semanas y asi      ,sadness
7671,demasiado tiempo ha pasado desde no un sabado    ,sadness
7672,banda esta del              ,anger
