,text,label
10259,una hora esperando llegue hamburguesa llevo 10 minutos por lo,anger
10260,gente toxica e mejor lejos cerca        ,joy
10261,hace falta mi amiga            ,sadness
10262,odio mi cosas y no          ,anger
10263,kcamexico ahora en este fin semana quede en casa  ,sadness
10264,como duele decir no joda y al      ,sadness
10265,pico toda vida              ,sadness
10266,quiero ir al cine            ,sadness
10267,mi tio quiere ma mi          ,joy
10268,solo al chupa pija mi vecino se le el 3,anger
10269,wtf con mi estomago            ,sadness
10270,mi papas no cuando yo acuesto dormir siesta loco ponen,anger
10271,traigo antojo unos pero pinche no mamen      ,sadness
10272,el otro finde no lo pienso 2 veces y voy,sadness
10273,vete alv para este pinche clima feo mejor hubiera quedado,anger
10274,los doble en mi oreja derecha son un karma  ,sadness
10275,mas puedo pedir  pura felicidad cargo      ,joy
10276,como despues ver llorar tu abuela en frente tuyo  ,sadness
10277,el diga te va doler mucho no te motivo tanto,joy
10278,creo subi al bus muerte          ,sadness
10279,no nada                ,sadness
10280,volver comenzar volver aprender estar sola  ya no pienso,sadness
10281,ke duela he  [?] [?]        ,sadness
10282,neta su queria ir feria          ,sadness
10283,disfrutar tranquilidad ni tiene precio          ,joy
10284,feo e ver del servicio uber        ,sadness
10285,mal ahi te dejen asi          ,sadness
10286,tengo armar el bolso porque manana se vuelve rutina ,sadness
10287,estoy mal humor tengo sueno e domingo y tengo leer,anger
10288,termine do en cinco dias quedo sin serie    ,joy
10289,tengo hambre y mi mama recien esta cocinando    ,sadness
10290,estaba re bien tremendo bajon tengo va estar todo bien,sadness
10291,ando viendo los video del y amo escuchar sus  ,joy
10292,y encima estoy como nadie peor yo      ,sadness
10293,tengo mucha moral  ya debo cambiar mi forma ser,sadness
10294,tengo miedo le alguien mas y se empiece olvidar mi,sadness
10295,no le voy dejar no saludo esa noche encima dice,anger
10296,un domingo distinto por persona          ,joy
10297,otro mas te extrano tanto          ,sadness
10298,en serio estuve con por do horas mas o menos,sadness
10299,todo andaba bien hoy bad desde el alianza lima juega,anger
10300,ya se fue el y tengo hambre      ,sadness
10301,y hoy no abre el ta listo      ,anger
10302,donde sera venden el carino necesito vengan un millon  ,sadness
10303,ahora esto e personal            ,anger
10304,manana entro escuela y no tengo ni cuadernos    ,joy
10305,mal puse cuando pregunto eso          ,sadness
10306,maleta y                ,anger
10307,necesito nuevos amigo              ,sadness
10308,ok kevin ya esta cabeza x salir en su cumple,anger
10309,se parte cabeza y tengo un humor divino    ,anger
10310,te quiero aqui conmigo            ,sadness
10311,quiero ver mi              ,sadness
10312,no salgan su casa despues 2 manana      ,sadness
10313,? todos los van ser asi porque ya no quiero,sadness
10314,cada vez pega mas parece q lucas no este siempre,sadness
10315,ma porra                ,anger
10316,pues yo quiero tener sobrina pero se aun no e,sadness
10317,le pasa gente igual estoy ser como      ,joy
10318,pasen rapido horas loco porque no se como he tanto,sadness
10319,no quiero ir al medico          ,sadness
10320,buenas noches otro dia menos          ,joy
10321,dormi y levante recien ahora como odio sentirme mal  ,anger
10322,gusta cambiar                ,joy
10323,necesito traigan el cafe cama y con algo dulce  ,sadness
10324,chale sad                ,joy
10325,termine do tres series diferentes en mi vacaciones estoy muy,joy
10326,no se si siento o soy un pelotudo    ,anger
10327,aca no dice si necesitas una misa malo chabon  ,sadness
10328,gracias                  ,joy
10329,hay gente solo necesita una excusa un para llevar cabo,sadness
10330,quien se case conmigo tendra aguantar lo use como oso,joy
10331,sinceramente este equipo da verguenza          ,anger
10332,estres este domingo en pijama          ,sadness
10333,se arranca el ultimo dia laboral        ,joy
10334,mi carro                ,sadness
10335,ay si estoy bien            ,sadness
10336,re podrida                ,anger
10337,no fui vega por ti y con      ,joy
10338,cada vez veo alguien en una foto con blancos dan,sadness
10339,flor lleva su              ,joy
10340,5 pa todo              ,joy
10341,aburrimiento                  ,joy
10342,siempre lo he dicho esto e una  solo espero,sadness
10343,mi ciudad con y yo aca        ,sadness
10344,alguien quiera venir almorzar y ver peliculas conmigo    ,sadness
10345,quiero irme casa ya mismo          ,sadness
10346,lpm quiero canciones dejen llevarme recuerdos hacen miserable    ,anger
10347,toma no                ,anger
10348,cena te verde con 2 pan        ,sadness
10349,q paja da              ,sadness
10350,ayer trabaje y el sol estuvo genial todo el dia,joy
10351,ya decia yo habia visto ante en      ,joy
10352,no mas en ningun sorteo y mucho menos compro una,anger
10353,puede loco                ,sadness
10354,lindo fue poder dejar mi en ese lugar    ,joy
10355,voy esa estupida cuenta            ,anger
10356,yo tambien quiero ser igual feliz        ,joy
10357,no quiero enfermarme nuevo            ,sadness
10358,como tres cuadras diaz            ,sadness
10359,un chongo entienda pido nomas          ,anger
10360,los el wifi              ,anger
10361,mo voy conocer              ,joy
10362,siempre pensando en lo mismo          ,sadness
10363,siii y duele darte cuenta cosas no son porque tu,sadness
10364,placer vida morir risa hasta llorar mi amigo son tan,joy
10365,pocas ganas armar valija            ,sadness
10366,hubieran sacado hermana ni e famosa se tenia quedar no,anger
10367,y total solo tengan al espanol en      ,anger
10368,libre gordillo  siempre lo fue  o no una,anger
10369,mal volver en el bondi con todos los pelotudos van,sadness
10370,cuando tu novia te            ,sadness
10371,el lunes entro clases no quiero        ,sadness
10372,triste mi chica los finde lpm  necesito aca mimos,sadness
10373,preparando los                ,joy
10374,felizsabado pa ti lo q e yo soy feliz ,joy
10375,no no                ,sadness
10376,lindo despertarme esta hora por una crisis      ,joy
10377,q lo paso fatal durmiendo sola        ,anger
10378,no estoy lista para mi ultima semana vacaciones    ,sadness
10379,ahora estoy                ,joy
10380,por esto rio en situaciones no deberia e por mi,joy
10381,cae mal cuando              ,anger
10382,en esto se mi eso          ,joy
10383,ver si mi amigas se pongan en modo y pagan,joy
10384,mood con y no son desayuno        ,joy
10385,date cuenta                ,anger
10386,y parece nuevo el cerro          ,sadness
10387,donde                  ,sadness
10388,una novia como              ,joy
10389,no fue una re ufff noche pero lo importante era,joy
10390,se                  ,joy
10391,dicha no sali ayer porque hoy        ,joy
10392,y parece veremos acostado con          ,joy
10393,si alguien se escribir fantasia aqui tiene algunos consejos  ,joy
10394,y yo como llorando  eso no falla nunca  ,sadness
10395,te tengo en mi cabeza todo el tiempo    ,sadness
10396,mi hermana le cambio contrasena mi y ahora no puedo,anger
10397,hizo dano el              ,sadness
10398,bronca estar asi              ,sadness
10399,no quiero regresar              ,sadness
10400,asi como cuando uno toda fotos los viajes asi  ,sadness
10401,aunque le mucho interes alguien nada si el no lo,sadness
10402,fua victoria quien ma te va por ig    ,anger
10403,hoy estuve todo el dia con el      ,joy
10404,no se si pero no esta mal      ,joy
10405,                  ,joy
10406,wow estoy tan orgullosa mi ninas        ,sadness
10407,quiero un estrella  y aun no encuentro uno [?],sadness
10408,le voy decir para hacer un partido hockey    ,joy
10409,e joda                ,anger
10410,una nueva propuesta gracias dios          ,joy
10411,no puedo sentirme tan para el orto      ,sadness
10412,siento harta tantas cosas y no puedo hacer nada al,anger
10413,como vengo enfermar un lunes          ,anger
10414,era q ya no iba tomar mas      ,sadness
10415,no se puede estar en ningun lado te cai gorra,anger
10416,manana no quiero ir trabajar          ,sadness
10417,pasapalabrachv sorry pero fui feliz con el error del sebastian,joy
10418,caro                  ,joy
10419,siento poco poco todo va          ,sadness
10420,voy dormir                ,sadness
10421,xq pero siento q hoy va pasar algo    ,sadness
10422,necesito un                ,joy
10423,lo unico espero no se haga costumbre levantarme todos los,anger
10424,justo habia despertado con ganas hacer un al llueve  ,sadness
10425,como si le              ,sadness
10426,no te va dar cuenta no quiero una amistad noma,joy
10427,buen dia sabado todos aca ya tengan un lindo dia,joy
10428,muchisimo mejor [?]              ,joy
10429,mi familia se piensa soy personal todos mi sobrinos tienen,anger
10430,cosas tan simple mi dia          ,joy
10431,y yo nunca ser amigas por mas yo lo intente,sadness
10432,ganas volver                ,sadness
10433,super mala educacion te pongan bien pedo y no te,anger
10434,tu ira y tu yo viendo ropa y por lavar,sadness
10435,quiero todos los lo una foto para verlo    ,joy
10436,tu ya verte con ninas y yo aqui con una,sadness
10437,e ni se como sentirme          ,sadness
10438,se estan perdiendo los            ,joy
10439,esto e una sigue estilo i s i s ,anger
10440,lpm se va bateria muy rapido        ,anger
10441,tal cual                ,sadness
10442,preguntas pero sean y respondo          ,joy
10443,en mi caso eso no preocupa otra cosa    ,joy
10444,estoy bien sad porque yo manana no regreso uni  ,sadness
10445,odio                  ,anger
10446,no mamen e neta            ,anger
10447,un bebe 7 por tanto          ,joy
10448,sabado 1030 pm y ya estoy diablos pasa    ,sadness
10449,bailando back                ,sadness
10450,escuchar algunos y te los oidos  ademas preguntarme hacen,anger
10451,ni un minuto silencio            ,anger
10452,si tu quieres le puedes preguntar al mismo diablo no,joy
10453,con nadie se queda bien          ,anger
10454,y no fuimos pa            ,joy
10455,solo son noches              ,sadness
10456,creo fuerte pero no soy ma debil sensible    ,sadness
10457,felices 21                ,joy
10458,encima le hemos ese dia no se en    ,anger
10459,le pregunte                ,anger
10460,un buen dia              ,joy
10461,quiero  algo para esta noche        ,sadness
10462,despues en piscina ver            ,joy
10463,lastima no                ,sadness
10464,varios cumpleanos y este dia          ,joy
10465,ayer clasico espero una tarde tranquila        ,anger
10466,ma bronca agarro              ,sadness
10467,mal levante                ,sadness
10468,quien dejo toda su familia fuera su casa    ,sadness
10469,duele el corazon              ,sadness
10470,en serio no puedo como desde hace 10 min porque,sadness
10471,20 dia                ,joy
10472,wtf estan horribles los horarios semestre        ,anger
10473,el cerebro sabe lo le pero el corazon no sabe,joy
10474,copado justo un domingo haga lindo dia      ,joy
10475,bueno nunca mas trato ser tierna con nadie    ,anger
10476,le dar rt y mg          ,joy
10477,nadie sabe                ,sadness
10478,estaria necesitando rocio              ,sadness
10479,creo pensar q lo vi no sea cierto    ,sadness
10480,por dios                ,sadness
10481,cuando llega una instagram cosas o siento estan diciendo bueno,sadness
10482,q asco  siempre mi familia gordo o q no,anger
10483,to super                ,sadness
10484,tengo el ojo horrible lo unico espero sea alergia y,anger
10485,siento algo feo en mi corazon        ,sadness
10486,ayyyy despues estar el y mi vida durante anos con,sadness
10487,fantasia han dejado tirada para el concierto hoy y voy,joy
10488,lo odio por hacer el concierto hasta monterrey    ,sadness
10489,siempre lo                ,anger
10490,era necesario despertarme esta hora          ,sadness
10491,asi ayer le pusieron el como mejor opcion    ,sadness
10492,borre toda fotos tenia con el        ,sadness
10493,quisiera poder entender el porque cosas        ,sadness
10494,camisa s y camiseta l y m ultimas quien quiere,joy
10495,buen domingo                ,joy
10496,como hace falta serie luis miguel        ,sadness
10497,no gustas agosto              ,sadness
10498,pues bueno sabia              ,sadness
10499,irse vacaciones conocer un chico en el hotel y saber,joy
10500,se puede decir mas alto o mas bajo pero no,joy
10501,desastre como esta jugando u          ,sadness
10502,dios quita pero cuando            ,joy
10503,no termino salir una y ya dan otra    ,sadness
10504,cuando voy aprender no debo esperar nada nadie nunca pero,joy
10505,si matar fuera legal no estaria llorando los nervios  ,anger
10506,ganas estando                ,sadness
10507,veces trabajar hasta tan tarde y no haber visto el,sadness
10508,tanto espere el sabado para nada        ,anger
10509,el aburrimiento dan ganas hasta llorar        ,sadness
10510,hacen sentir especial              ,joy
10511,como estar enferma              ,sadness
10512,"por dicen "" recuerdo ""  no      ",sadness
10513,veces tengo tan bien corazon por eso estare sin cel,joy
10514,lo mal q m siento          ,sadness
10515,se terminan vacaciones  donde saco ganas para volver cursar,sadness
10516,favor del aborto clandestino            ,anger
10517,estas alturas y yo sigo poniendo mal x lo mismo,sadness
10518,ganas un helado              ,sadness
10519,mi familia e cool en dosis pequenas      ,joy
10520,extrano estar con mi familia          ,sadness
10521,? como                ,anger
10522,tal vez no te pienso pero no te olvido tal,sadness
10523,hacen los ahi por favor          ,anger
10524,ojala sea posible              ,joy
10525,ya no puedo esperar para ser independiente y subir mi,joy
10526,dia lpm y yo aca          ,sadness
10527,igual todo lo              ,joy
10528,y otro para fran            ,joy
10529,hoy va ser un gran dia        ,joy
10530,estaba muy y fui al mall y di cuenta ropa,joy
10531,envidia da gente come y no un verdad    ,joy
10532,e poco                ,anger
10533,esta en oreja  ke          ,joy
10534,por mas intento estar ya no puedo      ,sadness
10535,quiero ver jimin con el pijama porque se super tierno,sadness
10536,padre manana entran los nuevos al lo yo por estar,sadness
10537,hola te extrane nada            ,anger
10538,voy seguir                ,anger
10539,por aca todo              ,anger
10540,no quiero entrar escuela            ,sadness
10541,seguir sufriendo entonces              ,sadness
10542,bien cae gente entiende como se usa twitter    ,joy
10543,un dia eres joven y el siguiente te mal por,joy
10544,bonito e saber razon  ahora si se venga paz,joy
10545,yo lo se e esta foto va partir el alma,sadness
10546,no olviden los se han en esta      ,joy
10547,eran 6 ahora son 9          ,sadness
10548,mi accion buena del dia fue darle comer los perros,anger
10549,chido e en tu calle un puesto dulces y  ,joy
10550,ganas dormir con negra            ,sadness
10551,siento si esto sigue asi seria una mentira para los,sadness
10552,el mismo error constante un paso adelante y do atras,sadness
10553,no los leo los buenos dia  ptm ya tengo,joy
10554,laura gustaria mi mejor amigo ser mi mejor amigo  ,sadness
10555,tierra trague y en alguna piscina        ,sadness
10556,hoy e uno esos dias en los no ganas salir,joy
10557,no hay nada para el calor con una y peli,joy
10558,para voy repetir lo mismo dije semana pasada    ,sadness
10559,cara                  ,sadness
10560,siempre quise tener una hija para comprarme cosas y decir,joy
10561,look                  ,joy
10562,extrano tanto                ,sadness
10563,necesito un abrazo              ,sadness
10564,yo tengo muy buena suerte en mi do van ninos,joy
10565,como se le hace para no extranar alguien    ,sadness
10566,no pongas prueba mi paciencia porque e      ,joy
10567,un par piernas nuevas por favor hace del lunes tengo,sadness
10568,quiero otra serie como merli          ,sadness
10569,lo bien estaba yo hoy en playa y hacen ir,anger
10570,volvi triste pa mi casa xq no tuve tu beso,sadness
10571,volvio                  ,joy
10572,no puedo llegar              ,sadness
10573,no quiero pasar en mi casa toda tarde con dia,sadness
10574,estoy tan enojada y triste vez cansada pasar estas cosas,sadness
10575,muchas cosas por mi mente          ,sadness
10576,cago en youtube              ,anger
10577,mal                  ,sadness
10578,mi novio se va medio dia y yo asi no,sadness
10579,esas veces necesitas un abrazo largo        ,sadness
10580,esto queda experiencia debo seguir salidas gente porque siempre se,joy
10581,paja volver rutina              ,sadness
10582,fui dormir del orto y levante peor      ,anger
10583,volviendo nacer                ,joy
10584,en mi corazon gano toluca          ,joy
10585,no se leyendo esas cartas          ,joy
10586,? como esta hora            ,sadness
10587,? quien se le ocurre llamar una junta en sabado,sadness
10588,va                  ,joy
10589,ya no se como empezar pero pues ahi vamos desde,sadness
10590,quiero una torta              ,sadness
10591,no quiero irme aqui            ,sadness
10592,luego ganando el casi se lo gana con sabor tristeza,sadness
10593,ya                  ,sadness
10594,ultimamente son solo noticias malas          ,sadness
10595,haber                  ,joy
10596,nadie quiere estar donde no se siente bienvenido    ,sadness
10597,vamos dar una vuelta            ,joy
10598,se fue el finde y no hice nada lo queria,sadness
10599,26 en 24 hr en cd        ,sadness
10600,fumo                  ,sadness
10601,alguien al esta bastante aburrido          ,joy
10602,ya lo dijo  jajajajaja          ,sadness
10603,mi crush no habla            ,sadness
10604,esta empezando gustar              ,sadness
10605,muero sueno                ,anger
10606,menos mal faltan 7 dias para noma      ,joy
10607,estoy un tener 500 ? por ex      ,sadness
10608,triste pone no tener con quien compartir algunas cosas  ,sadness
10609,ya no quiere mas            ,sadness
10610,se puede llorar tanto x una pelicula      ,sadness
10611,intente cambiar una mi por una nueva y falle rompi,sadness
10612,no quiero hacer maleta porque no quiero ir    ,sadness
10613,noche tan triste              ,sadness
10614,manana quiero playa  pero tanta noticia tienen en panico,sadness
10615,siento triste                ,sadness
10616,ya va el otro            ,joy
10617,siempre e misma              ,sadness
10618,usted se puede una pija          ,joy
10619,triste haya gente tan poco profesional no le dieron  ,sadness
10620,mi                  ,sadness
10621,se                  ,anger
10622,estoy tratando dormir pero no puedo  lo peor e,sadness
10623,bueno ya esta vamos empezar vuelta otra vez    ,anger
10624,un dia eres joven y al otro te levantas 500,joy
10625,yo soy el izquierda gracias          ,joy
10626,e mi ano fuera casa y sigo poniendo triste cuando,sadness
10627,v 9 pm hora local el equipo se hoy color,anger
10628,hoy voy o voy echar menos        ,sadness
10629,hasta cuando podre volver dormir          ,sadness
10630,cada comentario boludo hay leer dios alguien saque los ojos,anger
10631,jajaja buena onda              ,joy
10632,bajon no puedo escuchar musica en el      ,anger
10633,quiero playa y mi novio gracias bye      ,sadness
10634,el donde esta              ,sadness
10635,lit e muy no tener quien contarle mi situaciones y,sadness
10636,quiero hacer algo              ,anger
10637,y ahora estas tu sin mi y hago con mi,sadness
10638,pero voy pa '            ,joy
10639,triste e no poder comer nada con lo ricas son,sadness
10640,rompe bola se pone con venir cuando tengo estudiar  ,anger
10641,buenos dia tengas el dia mereces        ,joy
10642,o cuando el al equipo musica        ,anger
10643,quiero salir                ,joy
10644,pense todo habia quedado en el olvido hasta hoy el,sadness
10645,4am hora sale el up le unos y para ayudar,joy
10646,no puedo gane el            ,anger
10647,pedazo pelotudo                ,joy
10648,esta hora y yo pensando en hice mal    ,sadness
10649,con esta situacion no dan ganas ni cama    ,sadness
10650,diez anos chocolate no vienen mas y mama viene meter,anger
10651,necesitaria un consejo y un buen abrazo nada ma  ,sadness
10652,apenas van dar 11 y ya estan por mi casa,anger
10653,ver si echar y y vamos poco poco limpiando el,joy
10654,mejor hubiera quedado en casa          ,sadness
10655,extrano                  ,sadness
10656,3 dia                ,anger
10657,creo los 22 millones tiene manuel he sido yo  ,sadness
10658,tal vez sea lo mejor          ,sadness
10659,se todo seguia pedo            ,sadness
10660,corre y va nuevo            ,joy
10661,pobre mi novio con tanto cambio humor ya no tarda,sadness
10662,control calidad esta volviendo loca y apenas llevamos una clase,sadness
10663,y energia                ,joy
10664,q lindo finde gracias por tanto        ,joy
10665,mi dijo q asi parezco mujer algun si q e,sadness
10666,linda ya e              ,sadness
10667,odio tener q hacer cosas por lpm      ,anger
10668,lo rapido puede cambiar mi humor e impresionante    ,anger
10669,alguien para hacer tour empanadas por el barrio    ,sadness
10670,mi solo importa alguien ni quiere presumir      ,sadness
10671,ahora va dormir toda tarde          ,anger
10672,ya no quiero perderme tratando nuevo        ,sadness
10673,yo pensaba nicolas maduro estaba en porque se habia muerto,sadness
10674,quiere llevar plaza  adivinen quien se quiere matar  ,joy
10675,rubia aca conmigo              ,sadness
10676,menudo esta dando              ,sadness
10677,en mi top estan el papa y  queria  ,joy
10678,no se no haga extrano maduro los drone con fueron,joy
10679,odio los tocan musica en los no dejan comer bien,anger
10680,como caga no conteste si esta en linea    ,anger
10681,duro e esto              ,sadness
10682,se re pego el tema del marginal      ,anger
10683,ojala este                ,sadness
10684,pues listo                ,joy
10685,esa calma ante del caos          ,joy
10686,estaba abajo mi cama            ,joy
10687,vamos tener ir              ,joy
10688,no anda bien internet y no puedo jugar en linea,sadness
10689,no dire nada pero            ,joy
10690,tanto perdi del mundo del ahora e      ,sadness
10691,pesar con lo paso con imagino e muy duro perder,sadness
10692,siempre va encontrar              ,joy
10693,feo e no tener tu telefono aunque nadie te hable,sadness
10694,este chabon tiene menos huevos yo  lo odio con,anger
10695,soy una mala persona            ,sadness
10696,mega                  ,anger
10697,lo peor del domingo e decirle adios al    ,sadness
10698,son tantas fotos boludo            ,anger
10699,por mas dias como ese          ,joy
10700,al final el pajero del fran no hizo nada lo,anger
10701,lo q sea por un masaje        ,sadness
10702,estoy muy wey para indirectas          ,joy
10703,hace el 40 por favor termine ya el partido  ,anger
10704,hoy te vi ya lo se pero algo en mi,sadness
10705,ya vienen y yo sigo sin saber bailar    ,sadness
10706,miren e lunes y ya tienen todos pelota por el,joy
10707,hasta el sueno se paso con el miedo hizo pasar,anger
10708,odio gente sea muy y se quede viendo nunca han,anger
10709,ir caminando y su olor porque una ella uso  ,joy
10710,podria haber sido un domingo pero no      ,joy
10711,ganas un abrazo suyo en este        ,sadness
10712,no quiero sea manana            ,sadness
10713,si por tu culpa fue          ,joy
10714,tambien estan e vaya caida          ,sadness
10715,no se si llorar o          ,sadness
10716,en sombra debilidad              ,joy
10717,siento nunca lo voy superar          ,sadness
10718,compre el disco para ir          ,joy
10719,queria seguir durmiendo calentita en mi cama      ,sadness
10720,ahora en mas todo sera por mi y para mi,joy
10721,haces si en tu casa no hay accion pagar  ,sadness
10722,todos deberian entonces tener esto tiene acabar      ,anger
10723,pls                  ,joy
10724,gusta torta con con pero mi dame lo clasico con,joy
10725,adivinen quien y comenzo llover  hermosa e vida  ,joy
10726,tu pinta sonrisas en            ,joy
10727,luna                  ,anger
10728,urge el cabello              ,joy
10729,hay noticias uno nunca quiere recibir no puedo    ,sadness
10730,hace como 40 anos no tengo relaciones      ,anger
10731,yo solo quiero un novio lleve siempre playa tanto pido,sadness
10732,si para el miercoles no llega el voy tener hacer,joy
10733,justin no tiene hermana            ,sadness
10734,el mal humor estoy manejando          ,anger
10735,dificil e despues tanto tiempo y no poder evitar sonreir,joy
10736,yo con una amiga cago por pendeja      ,joy
10737,cuando familia se sienta y todo lo le sabes donde,joy
10738,flaca y etc              ,sadness
10739,todo el mundo habla vez yo esto no lo entiendo,joy
10740,le estoy dando demasiado amor persona y estoy quedando sin,sadness
10741,esto tiene harto hasta el punto mismo odiar y sonreir,joy
10742,yo solo quiero dormir  no sean dormi casi 4,sadness
10743,por 5 segundos vi una cana y casi muero un,joy
10744,volvi pobreza por tener empezar escuela manana      ,anger
10745,si te con el pie baila con el derecho  ,joy
10746,no doy mas del sueno          ,sadness
10747,maldita sea justo cuando decidi dormir hablan      ,anger
10748,crei hablar                ,sadness
10749,trabajar un                ,anger
10750,y si no queres soltar ese pasado porque esta lleno,sadness
10751,mi derecho mi decision y porque da gana ser feliz,joy
10752,pone tan mal cuando no llego todo      ,sadness
10753,odio porque no se ve ni ma y no puedo,anger
10754,tener joder quien no jodio y no hacerlo eso e,joy
10755,cancion tanto se pego            ,anger
10756,8 anos cuando tuve uno estos        ,sadness
10757,quien mando venir al centro lleno por todos lados lpm,anger
10758,empezamos semana con una mas al       ,joy
