text	label
en el encontre algo muy          	joy
oye tu no regalos en pokemon go      	sadness
extrano un monton  asi te veo [?]    	sadness
hora jugar con sobrina            	joy
y ahora solo quiero dormir un poquito      	sadness
? por trae tan pendeja          	sadness
hay no recuerdo para nada          	joy
vete aqui                	sadness
llevamos 10 minutos y mi mama ya se durmio  	anger
yo no dije eso pero como piensas con eso quizas	joy
voy camino al trabajo y se antoja mucho ma comprar	sadness
olor humo                	anger
oye amor ven dormir conmigo          	sadness
manana tampoco tengo clases lindo          	joy
hola yo tengo principio            	joy
y quiero bici ahora pero no hasta martes    	sadness
sorry pero no hay cosas guardo solo para mi  	joy
acabo dar cuenta y yo no somos asi para darle	sadness
el uber puso mi cancion favorita 5 estrellas    	joy
do dia muy en en super  mix y  	joy
hoy mi jefe y una senora tambien ahora estoy  	joy
le da mg fotos martin busca fama esta    	anger
ustedes tambien le pasa cuando no salen sus amigas hacen	joy
ya  ya tengo sueno          	sadness
un dia estos va dar algo hacer tanto coraje  	anger
v i t o m n o c u  	anger
no falta nada para mi cumple        	joy
extrano mi casa mty con          	sadness
quiero por lo menos 6 fine semanas seguidos porfa  	sadness
ni dormir puedo              	sadness
copado che                	joy
soy un borracho con mas futuro gente no toma  	joy
parce necesito plan 4 6 tarde        	sadness
tristeza hoy no pude correr          	sadness
no gusta cumplir anos porque nunca se hacer    	sadness
se soy pero ahi estoy perro una taza leche con	sadness
no hay cosa mas maldita          	anger
oido ponerme roja cuando da pena        	anger
menos grupos menos              	joy
ojala se pasen rapido los dia hasta el martes  	sadness
da mucha tristeza              	sadness
mi dia ha sido una montana asi no este buen	joy
impresionante como mama no da lpm comida aparte para mi	joy
mi novio se enoja y llama por mi nombre  	sadness
y luego porque se enoja una        	joy
fua tengo el sueno re cambiado        	anger
por estoy despierta esta hora          	joy
se unos taco              	sadness
alguien lleve                	sadness
yo mama por hay mujeres mi mama por pendejas e	sadness
quiero sentir lo siento por ti por alguien mas  	sadness
tal vez manana sera todo un poco menos peor hoy	joy
yo queria celebrar como pantalon amarillo pero no se murio	sadness
mas uno le este tuit          	joy
puse lavar abrazo para dormir y ahora no voy poder	anger
eso                  	joy
odio tener sueno y no poder dormirme      	anger
sueno sueno sueno y mas sueno        	sadness
odio ser el tipo persona si se enoja contigo al	sadness
hay dias abro mi ojos y aun creo e mentira	sadness
encanta esta hora por q se re sincera y cuenta	joy
e tu                	joy
y nosotros en y            	joy
lindo e estar con mi          	joy
por favor no              	sadness
muchisimas gracias por otra tarde mas aqui esperando para nada	joy
como quisiera dormir con mi gordo lpm      	sadness
voy cerrar esto por un tiempo        	joy
desde estoy tratando dormir y nada        	joy
mi crush si ire una fiesta los do estamos  	joy
todos los dias despierto exactamente am y no puedo dormir	sadness
bestia con el dolor cabeza traigo        	sadness
sabes si                	joy
lastima no matar maduro            	sadness
tengo mucho sueno              	sadness
te amo nadie en este horrible mundo te merece  	sadness
mmm tengo q comprarme zapatillas y ni ganas ir sola	sadness
nada tanto como pagar por ir un bano da una	anger
no puedo dormir maldita sea          	anger
ultima vez q              	sadness
x2 todo lo dijo            	joy
hizo acordar los chico del barrio  eramos una los	sadness
despertar y ya no poder dormir        	anger
porra to                	anger
quiero unos max 1            	sadness
se puso una azul            	sadness
nunca pasa                	sadness
si piensan tienen mala leche mi estaba yendo capital en	joy
quien habra sido el hdp llamo manana      	anger
poco poco voy todos            	joy
juro si ante se sentia nuestras cosas ahora va ser	joy
darle mg aburro              	joy
recien fui pero lo extrano          	sadness
encantaria tener mucha suerte cosa ganar un sorteo y sea	sadness
era pero fue              	joy
en momento se acabaron vacaciones          	sadness
yo no llevo con ninguno          	joy
quiero irme ya casa e no voy aguantar estas mas	anger
dios mio quieren agarrar mi guitarra llamen al porque aqui	anger
no puede ser no encuentre una buena serie    	anger
bronca hacen dar algunas persona loco        	anger
no se porque veces siento tan sola      	sadness
estoy esperando el msj caro diga ahi voy llevo el	sadness
queria 1 amor              	sadness
solo por pensar los pensamientos no se ni durmiendo  	sadness
estoy mas el mar            	sadness
hoy solo quiero pensar en cosas hagan reir    	joy
estoy podrido descargar mi todos los dia para ver si	anger
con este clima tiene estar prohibido ir facultad    	sadness
ay este bajon no se quita        	sadness
0 ganas trabajar              	sadness
si fueras mi novio por cada pinche foto en insta	anger
gente bien metida bronca            	anger
solcito por fin              	joy
tengo dejar estar tanto con el celular      	anger
amo mi novio              	joy
no doy ma              	sadness
triste mami siento triste            	sadness
tenia mil cosas para contarle          	sadness
aburrimiento mananas                	sadness
extrano cuando el vecino su carro los fine semana  	sadness
donde saco los animos para lavar mi carro    	joy
y asi todos los dia estas mentiras acaban escuchar  	sadness
tengo una hermana tenia y justo ahorita no dejo pensar	sadness
y aparte d eso no te y ni te gusta	sadness
lo                  	anger
hoy senti mas oscar su enfermedad esta terminando con el	sadness
hermoso empezar el dia mal humor        	anger
mi dignidad dejo en cada nunca voy ganar nada jajaja	sadness
nadie deberia irse dormir con el corazon triste    	sadness
poco                  	anger
feo e ya no tenerte mi lado      	sadness
tengo q ira ver este y no poder    	anger
esa sensacion falta algo            	sadness
hoy otra vez dijeron senora neta veo vieja apenas voy	sadness
por mas y mas y mas intento no puedo 	sadness
por suerte e el ultimo finde pierdo el partido  	joy
duele el corazon cuando termino una serie      	sadness
para mi e tan dificil          	sadness
vamos feria                	joy
esta tarde he jugado un poco al y casi lo	anger
cosa linda el olor nafta          	joy
levante para banarme y apenas se        	sadness
manana volver rutina              	sadness
morir poquito cuando alguien quieres se burla tu depresion y	sadness
caso                  	anger
ya se armo el en cancha        	sadness
no quiero bajar del carro y quiero dormir    	sadness
aun tengo un chingo            	sadness
hoy tengo salir no hay con quien      	sadness
como hacer algo              	anger
perdon si hay cosas ahora pasan entiendo      	sadness
en este finde seguro            	sadness
no piensa cambiar no pienso quedarme        	joy
tenia mucho sin sentirme asi          	sadness
mina                  	anger
al igual y necesito mi          	anger
ganas estar con mi amigo son terribles      	sadness
eso si lo voy            	sadness
pinche toluca no mames            	sadness
yo tambien le quiero vivir el auto alguien para ir	sadness
hice mal                	sadness
contra 5 po wn contra 5       	anger
escuchar siempre alegra              	joy
quiero mi pocos amigo en este estado      	joy
llevo desde 5 diciendo voy poner estudiar son casi 8	joy
pq mi netflix anda lento si tengo 20 ma queres	anger
jornada 3 su madre ganar o intentar che    	anger
maquina aunque hubiera gustado estuviera para los tigres y no	joy
en serio no voy poder dormir        	anger
no te lo creo wn 10 min      	sadness
dio lpm                	sadness
creo alguien no duerme hoy lpm        	sadness
linda noche                	joy
? ven como felicidad no dura para siempre tono regresa	sadness
el nunca hizo un partido aca        	anger
queria verla mas querer lo necesitaba        	sadness
cuando quieren algo sacan tema conversacion decime lo queres y	anger
por eso soy siempre con los abrazos no sabes cuando	joy
terribles del america y pachuca          	sadness
 lo ahora da tu vida ! pero para  	sadness
lo mismo una y otra vez        	sadness
estan llegando los al barrio          	anger
venga mi novia dormir conmigo          	joy
pero mi mama quiere ir al mall y    	sadness
el resto tu dia sea excelente y sonrie va muy	joy
un [?] y estudiar            	sadness
primero aprende escribir              	joy
estoy cansada                	sadness
no tengo whatsapp y no pasa nada e una sensacion	joy
mi amor te extrano            	sadness
anda cagar con tu lluvia          	anger
puse este tuit y el siguiente era un 0  	joy
unas ganas sentirme bien            	sadness
baje                  	sadness
! feliz sabado              	joy
ya no se si hacer algo o irme dormir  	sadness
ig                  	joy
tengo hambre                	sadness
"encanta "" mina ""            "	joy
no tengo ni para el primer dia      	sadness
no se si llorar o irme lejos      	sadness
yo con estas pinch ganas y esta pinche lluvia no	anger
tiene un par d bien          	anger
no estaba falta respeto hacia el sr verguenza mujer  	anger
porque gusta hacer pendejadas            	sadness
nunca desperte tantas veces en una noche por el calor	sadness
necesito amistades nuevas para no estar aburrida un sabado como	joy
yo en clase filosofia            	joy
no se hacer              	sadness
punto para mi no suelo cafe        	joy
un presidente si senor            	anger
se los plane jaja            	sadness
recien llego y ya quiero ir        	sadness
todavia no lo puedo creer  triste noticia otro angelito	sadness
y bueno hoy casita no mas        	joy
hago cosas tan mal            	sadness
estoy muy contento ahora mi familia sabe soy    	joy
caminar con casi en calles e peor idea he tenido	joy
tengo ganas besarte              	sadness
quiero un piercing en lengua          	sadness
entonces soy horrible              	sadness
maldita sea hpta vida            	anger
estoy totalmente cuando uno quiere algo cambie debe empezar por	joy
quiero mi y mesa vuelta          	sadness
ahora si estoy confundida           	sadness
pone                  	joy
para tenia morir para fuera cierto el atentado sino no	anger
siempre                  	anger
ojala le salga todo bien          	sadness
ay ay                	anger
hoy sera un domingo demasiado          	joy
siempre dije muerte era totalmente          	sadness
e imposible verlo y no llorar feo todo esto loco	sadness
no interesa noticia si no paso nada bueno no saben	anger
pase rapido agosto              	sadness
levantar                  	sadness
si cagas cagas peda y         	joy
se hizo muy dificil al principio pero ahora estoy y	sadness
ese era esperanza para los          	sadness
tan van ser              	anger
"maldad e "" "" muchas fotos uribe y santos los"	sadness
voy comprar un solo para cortar        	joy
vida da vueltas y yo voy para arriba y el	joy
un domingo                	joy
creo qe voy morir sin mi        	sadness
yo lo unico espero e tanto esfuerzo realmente valga pena	sadness
le ha pasado conocen una mina no puede superar al	anger
no hay peor cosa te hagan trampa en el  	anger
no se cuando va ser el dia pueda volver dormir	sadness
por suerte tengo un grupo activo capaz no salimos un	joy
como cuesta ser tierna            	sadness
e una linda noche para          	joy
peor no puedo sentir no          	sadness
mi y p por mi no hablamos ma nunca  	sadness
y en todos los los  no venden para  	sadness
recien e miercoles lpm            	sadness
muy buenos dias todos            	joy
el otro dia lo vi en el festival senti como	anger
un para china esta            	joy
ganas salir hoy              	sadness
cuando pongo esa carita e pq se todo    	joy
pongo triste cuando se duerme y yo no tengo con	sadness
ay no quiero entrar clases e muy enserio    	sadness
si soy por preocuparme por mi futuro y empezar cambiar	joy
tio pasapalabrachv tu con nuestra ver jean en el programa	sadness
cansancio mental tengo necesito            	sadness
uno esos dias en tu pecho        	sadness
tenia idea no verla en un y bajando al perro	joy
maduro                  	anger
estoy ti aunque se no eres para mi y por	sadness
to                  	joy
dios                  	sadness
vida no te quita cosas te cosas te para mas	joy
casa del para algunos puntos con el      	anger
persona hermosa esta leyendo esto  solo quiero te quiero	joy
eu                  	joy
ganas nada                	sadness
no se despierta  y le suena mi tweet  	joy
y para cuando alguien diga eso        	sadness
el dia esta para dormir          	sadness
bronca cuando tengo hacer algo y por x cosa no	anger
siempre estoy buen humor cuando se trata ti aunque ni	sadness
porque si no e ahora sera manana amor con una	joy
neta esta horrible ti misma dejar persona una no eres	sadness
cr                  	anger
buenos dias pais              	sadness
siempre cago por ser bien pinche        	sadness
mi domingo ya no son lo mismo luismi    	sadness
no se si reir o llorar        	joy
politica                  	sadness
buscar algun y encontrar            	anger
lo peor todo e manana arranco otra vez el colegio	sadness
liga hp                	anger
lo unico entendi este tuit e su sentido del humor	sadness
empezar 0 pero con vos          	sadness
ahora si un lindo bano          	joy
este e                	anger
volvi enamorarme ti mientras estabas lejos        	sadness
hace como 3 semanas no veo mi amigo y los	sadness
esos recuerdos tienes y te el corazon en mil pedazos	sadness
encanta cuando musica  otros lugares        	joy
ay dios                	sadness
mi humor puede cambiar un segundo para otro    	joy
estaba hasta no se quien llamo mi celular    	anger
ya le compre los regalos para el dia del nino	joy
tengo los ojos ya            	anger
hay todo lo bonito vida para ser feliz    	joy
y tal le sus papa pues ya cenar invitaron y	joy
hay ganas estar contigo            	joy
hagan lo hagan no canciones no sean asi    	sadness
queme un poquito              	joy
justo como hace un ano primer dia semestre y super	joy
pedo los lugares comida traen al trabajo no los domingo	sadness
viajo do normal              	anger
voy extranar salir casi toda semana con mi amigo ahora	sadness
muchas gracias saludos              	joy
siempre voy amar              	sadness
y cada vez mas lpm autoestima ni hablar    	sadness
solo quiero sea miercoles quiero ver mi nada ma  	sadness
aaaaaa extrano pelear mi amigo  no los veo por	anger
mi no                	joy
modo quiero comer y se un siglo estoy paro y	anger
no puede ser tantos hombre chabon encima mi familia tienen	anger
uy como he vuelto te ha pasado ante era ma	sadness
querido hoy viendo pelis no importa no le    	joy
adios mi san carlos            	sadness
desde el                	sadness
si solo va estar mejor ni vengas      	anger
e todo plata hoy en dia en todos los  	sadness
existe algo mas feo perder los audifonos      	sadness
buenos dias  feliz dia todos los ninos y tambien	joy
estoy como                	sadness
espero no cagarla en frances por neta no se nada	sadness
trabajar los lunes en manana e aun mas dificil teniendo	sadness
si alguno nivel frances o puede esto      	joy
manana empieza etapa final en el        	sadness
no aprendo ma              	sadness
no gusta saquen platica en el hospital para eso traigo	anger
ese festivo si quedo            	joy
le pasa esta vieja pendeja del uber      	anger
el marido mi mama no viene mas y tengo una	anger
vamos chula va salir estamos todos con vos fuerzas  	sadness
extrano esos dias secundaria saliendo iba con mi mejor amiga	sadness
y                  	joy
mexico gano el pero como no e futbol pues le	sadness
mae con esta parezco mi abuela escribiendo      	sadness
voy acostarme e intentar dormir agarro un re frio  	sadness
y mi novia donde esta un momento yo no tengo	sadness
ya                  	sadness
estaba empezando con le valio madre y dejo hablando sola	joy
no mames como pueden saber donde quedaron mile millones  	anger
te extrano                	sadness
quedo tranquila porque se todo vuelve        	joy
y para cuando se termina depresion post      	sadness
no hay cosa peor en el mundo te quite paz	anger
oso cuando con ese            	sadness
ya esta ma              	sadness
porque los findes pasan tan rapido        	sadness
tiene re podrido el viento          	anger
no soy decime cosas una          	anger
al centro                	joy
encima e para ella se enoja        	anger
durante semana se fue los con d algo poco 	joy
oh por dios igual amo          	sadness
buenos dia 8 ma favs y acabo este sorteo  	joy
nada como unos buenos para subir el animo    	joy
le valga madre si tengo una en nariz    	anger
si yo cambio todos mi          	joy
no gusta ducha su bano          	joy
importante y triste lo ale en instagram sobre como ante	anger
sin comentarios mejor              	sadness
mi casa sin no e hogar        	sadness
cosas odio y el cabello          	anger
creo tengo depresion post viaje          	sadness
ultimo capitulo quinta vez            	joy
como hacen falta tus consejos te extrano      	sadness
los amigo aparecen peores situaciones          	joy
yo conozco solo uno el amor camiseta y confianza en	joy
quiero ir al parque            	sadness
y pues bueno todo esto e muy complicado    	sadness
ya no quiero sangre            	sadness
paja irme dormir sola cuando hace estaba durmiendo con alguien	sadness
necesito una segunda para ir          	sadness
ya estoy quedando sin            	sadness
no estudie nada pero pase un muy buen finde  	joy
otro hermoso domingo carreras risas y buena compania [?] en	joy
extrano mi otro twitter            	sadness
un domingo sin resaca            	joy
ayer sali con mi amigo u senti 10 anos mas	joy
alguien invite su casa ver maraton harry potter por favor	sadness
amo el bardo en redes decirles pero facebook ya e	anger
le mi novio un viaje disney despues terminar el bariloche	anger
manana regreso oficina despues una semana vacaciones      	joy
buscar una casa para en y darte cuenta q e	joy
ya se van por los metiendo el tema los meten	anger
los cargo conciencia              	sadness
encanto el del dragon            	joy
lo demas se como quiera          	joy
necesito un masaje              	sadness
yo soy dijo el del iba ser y comi el	joy
los sigo vuelta en instagram pasen sus      	joy
aun no se hacer para mi cumpleanos      	sadness
hoy no va creer lo bien piensa soy como nuestro	sadness
dia ma lindo y yo aqui en mi casa  	joy
hoy se quienes estan mi lado en momentos dificiles  	sadness
ayyy los celos              	anger
no amiga somos do            	sadness
si bueno aunque despues estas ultimas muy mal lo tienen	sadness
quiero despertar y sea septiembre          	sadness
queme con arriba rodilla y se puso bien feo eso	anger
tan bien y yo no daba cuenta te deseo lo	sadness
nunca en mi vida habia sentido tan otra persona  	sadness
y mi lo pide gritos  i sad    	sadness
hablame ser buena hija ante volver casa hoy pase por	joy
nunca pense podia llegar este momento        	sadness
espero conseguir laburo asi arranco el curso con    	anger
estoy bien enojada alguien se comio mi nada    	anger
puneta ta ta              	anger
pero bueno                	sadness
bronca gente ve mi gata negra y dice ay susto	anger
yo lo soy e su          	joy
senti mal y con tremenda ya esta      	sadness
esta felicidad tengo              	joy
sabado amp con mal humor          	anger
ya amigo                	joy
quiero mi                	anger
al pedo le conte            	sadness
seria lindo tener un proposito en vida alguna meta alguien	sadness
? hay si se en mi hay y no cafe	joy
? porque duele un chingo cuando alguien se va si	sadness
pobrecito                  	sadness
tengo ansiedad mil              	joy
yo ya no voy ser tan mamona con los inviten	joy
no se son peor si en villa o en  	anger
extranando ando                	sadness
otra noche mas sin poder dormir por lo veo y	sadness
todo va seguir igual            	anger
hace 3 q te fuiste y no sabes lo mucho	sadness
todo mg fotos mina noma lo unico asi e yo	sadness
pesadilla tan mala              	sadness
hoy en el se dieron cuenta escribo bonito    	joy
banda o quiero para mi  se pasan do  	joy
pasa he gente salir por y dicen si y yo	joy
ahora todos son fan d          	anger
quiero hacer algo              	anger
loco se merece lo mas lindo y lo mejor y	sadness
jajajajajajaja vez siempre consigo lo quiero        	joy
oye como se cagaron al con palabra  wea porque	sadness
qp con esa gente no deja vivir los demas o	anger
tan cierto                	sadness
su ex                	joy
proximo capitulo aparecer los           	sadness
tremendo bajon                	sadness
como caga diga asi jaja y lo peor e lo	joy
tan cierto duele              	sadness
odio ser mujer              	sadness
capaz estoy poniendo muy molesto          	sadness
espero todos en y zona hayan encontrado un lugar seguro	sadness
gustaria poder pasar un buen finde eterno y no uno	anger
final semana                	joy
esta pasando pero conmigo            	sadness
aun sigues extranando              	sadness
venia tan bien estos porque tuve sonar con el  	sadness
quiero un abrazo como el ayer        	joy
aqui bien feliz una pina no sabe pina    	joy
aburro mabel                	sadness
mereces lo                	joy
wn si uno en chile no da mas con los	sadness
lo primero cuesta ya no          	joy
ya extrano mi casita con mi camita y mi  	sadness
vida solita se quienes son tus amigo y quien no	anger
se puso celosa y encanto pero re toda veces donde	joy
re queme  esta            	anger
esa mina                	joy
y pa                	joy
yo tambien di cuenta quienes valen pena      	joy
comentarios                  	anger
queda tan triste esquina sin          	sadness
ah trabajar                	sadness
bueno te dejen un sabado          	sadness
esta bien                	sadness
no sabia era tan dificil persona amas      	sadness
ganas ante te vayas            	sadness
los del iphone tienen harta          	anger
el dia                	joy
quiero un abrazo              	sadness
pequenas ganas salir              	joy
y por eso e no tomo con un ron para	sadness
ya no quiero salir como en un      	sadness
esta semana creo su whats para no caer en tentacion	sadness
una mejor amiga tire fotos asi        	sadness
todos preguntan por ti aqui en mi casa    	sadness
lastima q no quieras como          	joy
duele mas cuando sabes no puedes hacer nada por ella	sadness
no encuentro manera              	sadness
ojala y soy el pinche hombre mas feo del mundo	sadness
puneta                  	anger
paja crema post              	anger
porque tiene miedo da            	sadness
domingo mate y pelis            	joy
te haces tan linda            	joy
con quien queme un            	joy
hermoso dia                	joy
estoy despierta desde 6 am caga no poder dormir bien	sadness
amaba los hoy ya no tanto        	sadness
pone triste hacer el super sola        	sadness
saca poca los              	anger
alguien para jugar al            	sadness
niego estar enfermo garganta hoy          	anger
vidal to barcelona              	anger
voy dormir devuelta              	joy
ultimo trabajo del viejito toda madrugada  sin dormir  	sadness
da una bronca cuando contesta asi wacho      	anger
bravo se le acaba buena vida        	anger
escuche cancion manuel y no creo pueda volver escuchar algo	sadness
como todos los domingo con dj        	joy
y aca va nuevo            	joy
llega el padre mi novio pero dijo el nombre ex	anger
salir fiesta y perderme sabado felices jamas      	joy
y pesar tantas aun sigo ahi        	sadness
tengo boca toda literal            	anger
espero estas no              	sadness
si ver con toda su grupo menos con pero con	joy
no entiendo pq rocio se le ocurre cuando mas necesito	joy
te odio nunca llegaron mi          	anger
este dia ha sido el dia mas toda mi vida	sadness
el dia puedo dormir un poco mas no puedo dormirme	anger
toda noche  ganas cama no        	anger
estoy preocupada por              	sadness
estoy en un y una nina no se deja mover	anger
porque entonces ya no seria laacademia seria otro programa  	joy
no llego tiempo para verlo          	sadness
mi papas tenian razon deberia haber mi casa y no	sadness
un domingo muy lindo            	joy
esto                  	anger
e el unico lo dice por solo conoce el pasado	joy
se acaba el partido y lleva 6 6    	joy
echar menos parece super bonito pero cono yo quiero estar	sadness
voy dormir sin nadie mande una nude      	sadness
estaria necesitando unos buenos masajes          	anger
como no pasa eso con          	sadness
hizo despertar esta hora            	joy
no dormi nada nuevo            	anger
verguenza                  	anger
sirve ser guapo si mujeres solo se en los sentimientos	sadness
nunca puede terminar noche bien nunca        	anger
desaparecer en un abrazo ya ahora        	sadness
todo el finde junto y hoy no duerme conmigo ya	sadness
? por pasan estas cosas          	anger
quiero ser una estrella en donde el acuerdo    	sadness
buenos dias  feliz domingo          	joy
dieron muchas ganas ir por mi guitarra y tocar pero	sadness
levante 7 manana para llegar facu y el profe llegue	joy
sinceramente espero le den por el orto      	joy
estuve paseo y todo el tiempo pense en ella creo	sadness
sorprende como todo lo saben desde su hogar    	joy
echo menos mi              	sadness
un good aunque sea            	joy
mi novio no responde y asi        	anger
duele cabeza                	sadness
encanta compartir meme y no lo voy dejar hacer hasta	sadness
ganas ir one              	sadness
? realmente e necesario tirar algo al suelo calle cuando	anger
