text	label
aca estan todavia tiempo hacer historia y justicia por nosotras	sadness
esta e mi cuarta noche si poder dormir    	sadness
duele verte asi              	sadness
choca con mi pacientes            	sadness
solamente queria estar con vos          	sadness
help los cuantos se deja extranar alguien e    	sadness
te extrano mi flaco            	sadness
ya se estaria en un huevo pareja mi viejo  	anger
pina q se esta perdiendo          	anger
estres con los entran cantar los no dejan ni platicar	anger
quiero vida                	sadness
veces olvido no todos le gustan los gatos    	sadness
vacaciones amp yo enfermo eso no esta bien    	sadness
estas empezando salir con alguien y repente llega tu ex	sadness
bueno bueno mucho por hoy dormir y manana disfrutar del	joy
ni mirar historias tranquila se puede ahora anda    	anger
extrano tanto mi carro            	sadness
maldito lunes                	anger
todo  el cumple junto con mi      	joy
son                  	anger
pinche coraje                	anger
estoy muy cansada del veo hora terminar ya    	anger
onda con estoy ahorita            	sadness
osea vine con  ahorita estuviera ya en mty alv	anger
tan real lo peor e esa gran amistad se termino	sadness
serum un gusto llevar mi sobrina al estadio bro 	joy
tengo todos mi pero ese hace no quiera salir por	sadness
ultimo fin encerrado en mi casa        	joy
amigo alguien puede explicar por el hijo del va arriba	sadness
como saca onda esten en linea y no contesten  	anger
ojala el viene al lado mi en el tren se	joy
hoy se arranca cursar con un hermoso parcial para arrancar	sadness
madre e el colmo mi          	sadness
maldita fiebre maldito dolor odio estar asi      	anger
no doy ma              	sadness
bronca ser pobre y tener laburar los fine semana  	anger
feo alguien e importante para vos te peor manera  	sadness
lo mas triste e almorzar en familia y no este	sadness
persona conocen no saben cuando enojo tienen un toque pero	anger
siento tan gente              	sadness
pa cuando yo en un evento esos      	sadness
noche en el mar con esta e un placer  	joy
y un dia dije hacer dieta y asi fue  	joy
no veo hora camila este bien extrano muchisimo    	sadness
estoy amor                	joy
ojala pueda estar asi bien por mucho tiempo    	sadness
muriendo lentamente                	anger
e lindo ver mi familia junta pero e triste saber	sadness
ojos chino sonrisa gigante            	joy
los snapchat ya estan bien          	joy
lindo e ir un cumpleanos cuando te dan    	joy
necesidad ir tan fuerte en y auto pelotudos lo ma	anger
los fine semana sin cerveza son muy tristes    	sadness
volvieron tres alarmas porque siempre apago primera y llego tarde	joy
estoy presion hacer algo no gusta y si gusta e	sadness
empezamos manana lunes              	joy
cuando llueve                	sadness
17 los en mexico            	sadness
mina                  	anger
esta vez si e muy enserio        	sadness
empece ver fotos y video y termine llorando    	sadness
ya                  	anger
ojala y sea eso no gusta pensar soy mala persona	sadness
fui al banco y ya no esta el gusta  	sadness
no crean tambien no pasa nosotras        	sadness
enoja no sean              	anger
no se en estaba pensando          	sadness
lindo y cierto mi cuesta mucho        	sadness
siento 3 semanas vacaciones fueron como 3 dias    	joy
todos en su peda en el y yo bebes  	sadness
gorda estaria rompiendo mucho bola  basta nena    	joy
todo el dia en cama y ni asi se mi	sadness
hasta cuando voy vivir asi          	sadness
por siempre se corta luz no tengo loco    	anger
yo tambien                	joy
esta wacha esta re cansado          	anger
con todo esto estoy            	sadness
no hace falta yo nombre more para este presente en	joy
muchas gracias por el rt          	joy
como te hago entender lo mucho te quiero    	sadness
e una maldad el diadelnino sea en pleno invierno  	sadness
horrible sentirse por alguien q amas con el alma  	sadness
queria contigo pero creo q toca solo      	sadness
estoy tan siendo mama no tiempo en tengo    	sadness
mi vieja se hace            	anger
ya no gusta estar sola          	joy
"dormir se ha vuelto una "" tareas "" mas dificiles"	sadness
yo tengo una              	anger
rica esa sopa              	joy
cansada                  	anger
maldito clima esta viendo como traigo el carro y viene	anger
se tambien tuve culpa y di cuenta tarde pero espero	sadness
mi mama siempre mi ropa o maquillaje      	anger
ayer por vimos como se re una camioneta fue horrible	sadness
si so hombre y estas en contra del aborto esto	joy
en si no e dia hay un queriendo cobrar por	anger
evento team un exito terminamos pero se sigue igual  	joy
casi pierdo el arito unas veces bronca y dolor  	sadness
estoy emocionada por entrar escuela ya quiero comprar mi mochila	joy
lo ma triste vi hoy fue mi abuela llorar  	sadness
ni ni defensa              	sadness
no se quiero hacer con mi vida      	anger
16 anos ya              	sadness
ya quiero volver vivir sola para nomas preocuparme por mi	sadness
oportunidad nuestras vidas              	joy
esta tiene                	anger
e lo estoy haciendo mal lpm        	anger
do                  	anger
muero por volver salir con mi amigo      	sadness
quiero ir                	sadness
lindo levante mucho mejor gracias dios        	joy
e increible falta hacen los          	sadness
no puede ser por dios acabo        	anger
ahh todo sea por jaja          	joy
tengo ganas una y ninguno los mi amigo responde una	anger
voy llorar del dolor d panza        	sadness
ire hacer ejercicio e lo unico en soy buena 	sadness
bueno lave el auto al pedo porque no para llover	joy
como baja saber no voy ir ma jodas al menos	sadness
8 los estamos aca y todavia no vino el  	joy
soy un desastre pero puedo con eso      	joy
nota del dia mi trabajo ideal seria probar y ver	joy
sabado domingo lunes mi plane creyendo el dia tiene horas	sadness
da como una felicidad por partida doble o algo  	joy
manana sin falta le  e he estado    	sadness
vuelvo virgen esperando al colectivo y encima con tremenda resaca	sadness
no  ya no estar bien        	sadness
no ya ni chinga este compa        	anger
verdad e si soy una mala persona todos puedo menos	sadness
alguien q quiera veni playa          	sadness
bue estoy para el otro          	sadness
senora quien tiene ganas estar hablando tanto desde    	anger
yo veo en el piso al vaya santiago no voy	joy
en lo del solo dejan mayores 12 anos no puedo	sadness
como puede haber gente dormida 1030 am vine visitar mi	anger
mi mama fue al super y pregunto si queria algo	sadness
quedo con los buenos consejos          	sadness
y no empezo cocinar            	anger
con el mensaje pense era esa persona      	sadness
no habra aqui alguien madrid quiera en su casa el	sadness
siempre porto bien y mi sentir se caos    	sadness
linda manana pase hoy lpm          	joy
yo los dias asi            	joy
yo en serio detesto escuchar esas cosas      	sadness
buen sabado                	joy
no quiero te mi            	sadness
asi e                	joy
ya extrano mi hermanita            	sadness
jamas mal alguien estuvo conmigo          	joy
como van eliminar cuenta            	sadness
tengo calor no puedo dormir asi        	anger
neta asi no se puede          	sadness
ya quiero estar en parte donde soy famosa y toman	sadness
alguien mas lluvia le unas horribles ganas no hacer nada	joy
alguien sepa y quite estas ganas        	sadness
buena noche con mi amigo          	joy
los una maravilla              	joy
empezo doler pierna otra vez          	sadness
hoy feliz dia del arbol para mi      	joy
era feliz y no lo sabia        	sadness
lo hemos perdido chicas            	sadness
caga los estados se vean super        	anger
una bronca dio el ultimo capitulo salio i love lpm	sadness
extrano sus                	anger
sabado quedarse dormir              	joy
gente ahora en y y yo vuelta el bajon  	sadness
odio hablen y no            	anger
mi pana ? en cual estos te gustaria recibir un	joy
necesitaba un dia como el hoy        	joy
todo mundo anda fiesta hoy          	sadness
no mas jugadores juegan con u otra fecha    	anger
ya casi llega              	joy
bonito e empezar semana sabiendo el gano y e del	joy
no se hacer              	sadness
cosa odio                	anger
ayer habia pizza en mi casa y pues no no	sadness
encanta volver trabajar lo amo e vacaciones hicieron    	sadness
chico al final no voy          	joy
lo odie                	anger
el colmo                	anger
no todos                	sadness
los padre mi d son super        	joy
gracias  saludos              	joy
sabia yo sabia si hacer algo iba joder esa rodilla	sadness
laacademia hoy y habia sido dani sea quien se vaya	anger
no puedo dormir              	sadness
solo espero se mi con          	joy
al final yo tenia razon          	joy
los cambios hace q el equipo malo malo    	anger
esos finale peliculas              	anger
asco tipo por favor compartir          	anger
quien diria no iba 2 horas hasta sino solo 50	joy
un video hace unos dias y no lo encuentro  	anger
esto esta cabron              	sadness
mi ultimo dia              	sadness
jaja                  	sadness
ya voy tener mi            	joy
ya mejor llevame diosito            	sadness
mi novio                	sadness
despues no vengas con no te lo dije    	joy
todo y hacerte para pasar bien        	joy
se hace boluda y se queda dormir en otro lado	anger
estaria bueno mi viejo no sea tan rompe bola  	anger
ver esa foto y quedarme un rato largo sonriendo  	joy
puse re mal cuando se fue        	sadness
esos vecinos estan con todo en y una aqui noma	sadness
una reina                	anger
yo sabia no no ibamos ver        	sadness
odio esperar                	joy
totalmente acuerdo                	joy
senora viene al lado mio podria bajar su musica intento	anger
no                  	anger
ele                  	anger
ya estoy en ultimo semestre y siento nueva con todos	sadness
mejor no ir entrenar sola          	joy
claro                  	joy
espero decision sea correcta            	sadness
otra vez madrugada              	sadness
jimin sabia eu te amo          	sadness
no le mas meme            	anger
o capas valla  ahre          	joy
donde estara mi compania para dormir una siesta    	sadness
cuando siento feliz tranquilo            	joy
los son los ma y he visto      	anger
extrano rei                	sadness
siento como si estuviera en el esperando mi turno se	anger
no estoy lista para ser mama        	joy
aun tengo esa conversacion en          	sadness
e dificil mantener una decision pero se e lo mejor	sadness
loco el tiempo esta volando          	sadness
estoy                  	sadness
cuando no se hacen cosas como        	anger
prontoesperoque cambien dj por esa tipa e una    	anger
termine temporada 8 grey y termine llorando peor en temporada	sadness
alguien quiera ayudar con mi tarea matematicas      	sadness
no gusta esa idea            	sadness
esta hora pinta el bajon          	sadness
paja extranar tanto              	sadness
no sabes como te estoy odiando ahora      	anger
pero con otros esta siendo un dia buenisimo    	joy
harta se rompan unas            	anger
como odio pasas              	anger
cansado andar perdiendo plata            	anger
quiero mi cejas sean iguales          	sadness
ya estan peleando              	anger
super yo y los perritos siempre le doy y si	joy
no usar mi lentes esta dejando ma      	sadness
no gusta manden al banco tan manana      	joy
siga todos rt e fav este tweet      	joy
lo mejor todo e mi padre usan misma excusa para	joy
odio gente sea             	anger
encontre felicidad                	joy
porque no se toda le hablan  ese e mio	anger
puede jugar con e en primera fecha no jugo y	sadness
gusta tener el control contigo simplemente no puedo    	sadness
lindo saber manana te veo          	joy
como falta momentos como estos          	joy
voy morir del dolor espalda          	sadness
ver barrio y tiene muy enojada el      	anger
mi amigo viajando por el mundo y toda esas cosas	sadness
24 h del dia estoy cagando        	anger
como le hago entender            	sadness
no dura nada el credito          	anger
te echo menos mi corazon          	sadness
ya                  	sadness
""" el justicia este "" ! increible      "	anger
para mi proximo truco necesito conseguir en bogota una y	sadness
do dias                	sadness
clase estres ando              	anger
no tengo nadie para salir          	sadness
urge                  	sadness
son en estas situaciones en te da cuenta lo te	joy
puedo estar enojada con mi novio y nada hablarle porque	sadness
!                  	sadness
gracias amable                	joy
como por este vivo y ir verlo un    	sadness
le tw le hablas con y no nada    	sadness
solo 4 dan verguenza y uno e mi    	anger
mi actual e y el no sirve      	sadness
quiero volver jugar al hockey quiero volver hacer lo ante	sadness
todo bien si hablas eh te extrano      	sadness
totalmente acuerdo todo lo            	anger
unica realmente saca una sonrisa nadie mas lo    	joy
yo no                	sadness
lo bueno e q no queda mucho tiempo en  	joy
algun dia dejare sentir celos mmmm e no    	joy
amo su sonrisa              	joy
y ella no deberia llorar por tu culpa    	anger
d                  	sadness
hermosa pelicula ahora levantarse            	joy
buenos dia                	joy
sabia iba pasar esto            	sadness
? por no tengo luz          	joy
el se pierde asi e el futbol      	sadness
mi mama se va y deja sola      	sadness
le tengo un miedo tremendo angel        	sadness
dia en el cuarto porque en casa      	joy
mi piel e tan sensible          	sadness
dificil e el dia dia          	sadness
veia tan bien alex joder          	anger
aburro                  	sadness
cuando solo necesitas un abrazo te diga todo va estar	sadness
ultimamente te he tanto            	sadness
responde toda historias y lo peor q escribe el pelo	anger
tengo sueno pero no dormi siesta por hablar con esa	sadness
pucha hoy tengo estudiar vida y amaneci con un humor	sadness
? hasta cuantas despedidas uno se termina      	sadness
facil regrese mi casa pinch          	anger
te invito dormir no y abrazo fuerte      	joy
con malas puerta para afuera hermana        	anger
como lo extrano              	sadness
duelen piernas y no e por hacer el toda noche	sadness
pense q iba tener igual ayer        	sadness
ante pablo y luego dani          	joy
nadie quiere acompanar comer            	joy
perdon pero extrano mucho comida en boca      	sadness
cuanto te necesito              	sadness
nadie dijo feliz dia y creo algo deje en este	sadness
vale deja re colgada            	anger
un beso tierno y lento ahora mismo una tarde llena	sadness
no pido nada mas            	joy
dejar persona amas e lo ma dificil hay    	sadness
tambien iba el dia nunca falta el      	anger
familia tia en paz vieja          	sadness
gracias gloria                	joy
una espalda nueva por favor          	joy
muy buenos dias              	joy
por el finde e tan corto por      	sadness
el alcohol se poca suelo tener        	sadness
poca madre pinch              	anger
y muchas                	sadness
tengo q comprar lo del dia del nino y el	joy
dolor                  	sadness
no gusta hacer trabajos en equipo        	joy
hola vi                	joy
decirle gente si haber tomado ni una sola copa e	joy
estoy mas un sueldo mio en esta fiesta y eso	sadness
porque se llamar estas hora ve el sueno    	anger
lo peor e si le pedi al arriba lo en	sadness
mi locura por un delicioso plato con y queso fresco	sadness
cr                  	anger
los porque nunca recibir cuando le dan verde    	sadness
capaz si era sincero no iba doler tanto    	sadness
feo cuando no para el amor        	sadness
empezo un vacio en el pecho        	sadness
molesta y celosa              	joy
yo si                	joy
para pongo organizar algo si se q llegado el momento	anger
quiero seguir durmiendo              	sadness
2 sin jugar futbol            	sadness
y se                	joy
si no no ganas y gane        	joy
pinch dejaron le vuelvo abrir puerta        	anger
mi creo no esta            	sadness
nadie entiende mi emocion por el final      	sadness
sera vida mi lo extrano          	sadness
queria quedar mas dias en          	sadness
no se ni un poquito          	joy
no habia dado cuenta eso          	sadness
creo e mejor quien hace dano por mas dolor sienta	sadness
prefiero dejen hablar por buena amiga lo hagan por mal	joy
mm mal                	sadness
e re tarde y yo ando aca terminando hacer el	joy
te estoy diciendo no puedo          	sadness
hace do h le estoy esperando y agus    	anger
tenia el pelo bien largo y lo corte y ahora	sadness
no quiero estar asi lpm          	sadness
siempre los mismos              	anger
"acaba seguir una pagina se llama "" soy re """	anger
no le pienso dar bola al celular      	joy
pinto y volvi mi casa          	anger
asi con pelota              	sadness
mal siento se parte cabeza          	sadness
agus se levanto ahora porque tiene ir trabajar y yo	sadness
efecto del cafe              	sadness
q                  	anger
cada vez no da mas coraje y cada vez como	sadness
tengo unas ganas hacer un curso        	joy
ojala algun dia pase bien mi cumpleanos      	sadness
bien hace un poco love esta hora      	joy
porque le en el            	anger
lpm duele todo              	anger
? como ya manana e lunes        	sadness
dormi mal                	sadness
eso tener dona en casa no esta nada bien 	sadness
extrano                  	sadness
felices aquellos se gustan y se tienen      	joy
preciosa imagen  gracias por amigo        	joy
quiero                  	joy
para seguir contra corriente no tiene caso      	sadness
quien salio  laacademia            	sadness
lo primero le dije y lo primero hace    	anger
hoy estoy con todo el mundo        	joy
mal humor                	anger
no puedo seguir con estos          	sadness
perdi o numero              	anger
los 2 huevos como            	anger
embole no hablar con nadie          	sadness
adoro los pantalones campana            	joy
cancion super caga y mi querida vecina ya puso 3	anger
mi papa hoy dijo fuera muy feliz lo no sabe	joy
tengo ir pa ' y no encuentro ninguna    	sadness
eres como los taco venden en calle estas super pero	sadness
noches feas y mia esta noche        	sadness
? porque gasto tanto dinero en        	sadness
siempre lo mismo yo y los        	anger
necesito mate en el sol y compania      	sadness
quien pregunte si he ido fiesta le voy decir si	anger
e una frase muy buena julio y tambien e una	joy
quiero q mi profe suba notas        	sadness
luego no si le sigue un poquito vista    	sadness
sabes nicolas no te creo nada        	anger
? alguna vez han llorando sin razon      	sadness
ire ver una pelicula terror tal vez no duerma esta	joy
malditos trauma amor              	sadness
bienvenida al club              	sadness
""" hizo dano pero tambien hizo feliz "" -- yo"	sadness
ganas un novio              	sadness
perdon pero no era para esa joda      	sadness
tome un chela con el del centro una buena noche	joy
cuando una persona esta podrida por dentro jamas va cambiar	joy
falte una clase doble            	joy
quiero con                	sadness
manana mi hermana entra prepa y duele ya no sea	sadness
como odio ser asi ganas pegarme        	anger
ando bien sad              	sadness
queres te diga cada vez muere un policia alegro situacion	joy
e un caso              	joy
vamos el amanecer en carretera          	joy
o en general ira mal          	sadness
no dura nada el fin semana        	sadness
creo no vino fer            	sadness
mi noches serian perfecta si estuvieras conmigo      	sadness
mi novio se corto el cabello y siento triste por	sadness
cuando preguntan mi nombre digo y terminan diciendo    	sadness
ptm estoy lleva vrg            	anger
nadie entiende                	sadness
tengo ganas salir pero no hay con quien    	joy
asi e                	joy
vamos                  	joy
quiero seguir durmiendo  no le pasa      	sadness
ma cara                	anger
parece demasiado injusto yo muero por tener un perrito y	anger
n dormir por causa do calor        	anger
un abrazo solo eso necesito          	sadness
abro instagram y estan todos viaje o comiendo sushi  	sadness
yo con mi crush            	sadness
volve ya                	sadness
wow como gusta ver mujeres jugando  buen dia gente	joy
creo los entre pablo lopez y y los veremos en	joy
quiero llorar mucho pq no estas aqui conmigo    	sadness
si estoy celosa y            	anger
amigo estoy en mi curso matematicas del y le juro	sadness
venia todos los domingo comer casa        	sadness
en una tienda del tienen un 4 partido al medio	sadness
por no con una nota          	anger
buenos dias y viaje hoy no volvemos      	sadness
pronto le mi feliz semana luna llena      	joy
no puedo sentir tan mal          	sadness
no se si ver el ultimo episodio the original  	sadness
acordar nunca tener hijos con tener cuidar mi hermanas 247	anger
siempre sera un gran clasico viendo sus peliculas hoy una	joy
nunca pense decirlo pero extrano mi trabajo      	sadness
mate con papa              	joy
ay                  	anger
ya quiero verte  muy pronto        	joy
cuesta tanto soltar              	anger
estaba todo re lindo y hoy siento le hago mal	sadness
pa                  	joy
pinche yo ya habia tentacion helado bombon      	joy
lo lindo saber hacia donde va e te chupa un	joy
el finde mas queria estar en casa toca estar afuera	sadness
quiero ir un taller algo para poder mi tiempo libre	sadness
te extrano demasiado              	sadness
quiero hacer algo hoy pero no tengo compania    	sadness
medio dia ya y no he hecho nada en el	sadness
nada mas bonito entrar hasta el 27      	joy
casi no pude dormir  odio ser asi    	sadness
tanto cuesta ponerse los pantalones y decir verdad    	anger
odio el horario visitas con todo mi ser    	anger
no te no esperanza no te gracias dios mio por	sadness
parte el corazon pero cada uno sabe lo hace  	sadness
dormir con e lo hago          	sadness
estoy muriendo por poder            	sadness
pero esta no deja            	sadness
verdad gracias vida no puedo creer lo q paso sinceramente	joy
buenas                  	joy
flores jamas moda              	joy
esperando princesa                	anger
hoy dia nadie ni han puesto fotos mias y los	anger
ay abuelo                	sadness
quien levanta                	sadness
en unica mujer q confio e en      	anger
el dolor espalda esta matando lpm        	sadness
no estoy triste porque manana e lunes pero estoy vacaciones	sadness
espero los ninos nunca se olviden mi      	sadness
te pone los auriculare y te habla hasta el perro	anger
asco carretera para llegar            	anger
el mejor no no dara mas clases era el unico	sadness
estoy entre hacer una torta uno e cuestion    	joy
"estoy viendo "" "" mientras almuerzo        "	joy
dormir otro ratito              	joy
felicidad manejo cuando mi mama veo bien saca lo mejor	joy
queda una semana vacaciones y e desde estoy en no	anger
ante 18 en mil y pico nada mas    	sadness
entro 4am no se si dormir o quedarme asi  	joy
mama queres                	anger
no queria yo              	sadness
ya frio pa dormir solo          	sadness
hice queso y una torta chocolate estoy para irme vivir	joy
los domingo e el unico dia puedo dormir hasta tarde	joy
tapia le con los cambios hay q ir buscar los	anger
no entiendo por mejor y esta parada      	joy
malditos fuera                	anger
gran inicio semestre              	sadness
quiero                  	sadness
jamas se hizo ir uno          	sadness
tengo ganas escuchar mario luis          	joy
voy matar mi hermana            	anger
vida esa manera              	anger
como cuando tus amigo dejan sus cumpleanos porque toda maneras	sadness
vamos tener ir dar unas vueltas        	joy
encanta saber verdad y preguntando para ver hasta donde llegan	joy
hoy tambien amo              	sadness
cagas vida pinche tigres            	anger
solo quisiera                	sadness
por tiene ser tan dificil          	sadness
como un completo extrano            	sadness
no hay nada odie ma estar esperando saca poca q	anger
quedo con lo bueno despues todo        	sadness
como odio quede olor en ropa y en el pelo	anger
rico ayer enserio hace mucho no pasaba ya genial  	joy
ojala se pudiera mandar en lo sientes ojala gente ojala	sadness
si lo un hasta por favor        	sadness
apenas esta cayendo el todo lo paso en 2 semanas	joy
soy tu hermana mayor            	joy
yo tambien tengo mi favorito solo se rodilla y ya	sadness
el una vez mas siempre un        	sadness
no hay pedo si noma quieren jugar el pedo e	anger
una dosis mimos mi novia pero ya      	sadness
tengo una y tengo ir trabajar asi      	joy
aun falta como medium hora          	sadness
del futuro cuando el wey te guste e distinto los	joy
cuando pienso cosas no ser peor        	sadness
estoy viendo y mi cabeza esta explota osea quien e	anger
lo unico                	sadness
quisiera estar 5 anos ante          	sadness
ganas quedarme acostada              	sadness
no estoy lista para regresar realidad        	joy
un re viaje en no le da para dormir no	anger
tengo do dias para lograr ir        	sadness
incomodo jajajaja quiero ya se cuenta        	joy
y todavia falta lo mejor          	joy
hubiera ido para agua o hoy        	sadness
dia no espera hoy buenos dias        	joy
estupido nudo en garganta            	sadness
e todo lo quiero no necesito mas      	joy
buenos dias tenga todos un excelente miercoles      	joy
haces el dia              	joy
solo hasta el martes y solo tengo como    	joy
mi mama y su llevarme fiesta yo no quiero ir	joy
no decir si estais bajon o quereis ver cosas bonitas	joy
estoy muy feliz porque ya casi tengo mi semana vacaciones	joy
dios mio                	sadness
cada vez estoy mal del higado como ahora antojo comer	anger
como duele ver mi sobrino asi        	sadness
