text	label
bonita se ve gente no se mete en lo no	joy
no quiero regresar escuela verle todos los mi salon  	joy
hoy hice fotos bonitas siento el spam pero queria  	joy
sabes como tenes con los tweet        	joy
10 dias y se va el        	sadness
como sera en el mundo          	anger
todo e ma bonito cuando sabes lo quieres    	joy
tenia mucho no              	sadness
na sa                	joy
le hice el pelo mi amigas y ahora yo no	joy
da verlo con los            	sadness
maldito insomnio                	joy
se                  	sadness
hay una nina toma fotos y siempre termina o el	anger
nunca voy poder sentir bien conmigo misma      	joy
llegue mi abuela y lo primero pregunto e si el	sadness
arroz    carne asada    tortilla	sadness
tengo frio                	anger
tengo unas ganas pero mi amigas le gusta mision  	anger
domingo aburridos si los hay          	sadness
tenia salir justamente ahora            	sadness
enoja cuando dicen mi apellido sin acento      	anger
ganas ver vela              	sadness
hoy mi los malos esta al maximo      	anger
se olvido mi              	anger
cuando una serie quiero ver no esta en netflix quiero	joy
en casa estan todos            	sadness
lastima ya no e como ante        	sadness
se hace linda con mi buzo jaja      	anger
espero no vaya bien con el estamos      	joy
con ganas nada              	joy
tengo q levantarme en una hora y yo sin poder	anger
fue re lindo y tu mama una divina    	joy
una hora esperando llegue hamburguesa llevo 10 minutos por lo	anger
gente toxica e mejor lejos cerca        	joy
hace falta mi amiga            	sadness
odio mi cosas y no          	anger
kcamexico ahora en este fin semana quede en casa  	sadness
como duele decir no joda y al      	sadness
pico toda vida              	sadness
quiero ir al cine            	sadness
mi tio quiere ma mi          	joy
solo al chupa pija mi vecino se le el 3	anger
wtf con mi estomago            	sadness
mi papas no cuando yo acuesto dormir siesta loco ponen	anger
traigo antojo unos pero pinche no mamen      	sadness
el otro finde no lo pienso 2 veces y voy	sadness
vete alv para este pinche clima feo mejor hubiera quedado	anger
los doble en mi oreja derecha son un karma  	sadness
mas puedo pedir  pura felicidad cargo      	joy
como despues ver llorar tu abuela en frente tuyo  	sadness
el diga te va doler mucho no te motivo tanto	joy
creo subi al bus muerte          	sadness
no nada                	sadness
volver comenzar volver aprender estar sola  ya no pienso	sadness
ke duela he  [?] [?]        	sadness
neta su queria ir feria          	sadness
disfrutar tranquilidad ni tiene precio          	joy
feo e ver del servicio uber        	sadness
mal ahi te dejen asi          	sadness
tengo armar el bolso porque manana se vuelve rutina 	sadness
estoy mal humor tengo sueno e domingo y tengo leer	anger
termine do en cinco dias quedo sin serie    	joy
tengo hambre y mi mama recien esta cocinando    	sadness
estaba re bien tremendo bajon tengo va estar todo bien	sadness
ando viendo los video del y amo escuchar sus  	joy
y encima estoy como nadie peor yo      	sadness
tengo mucha moral  ya debo cambiar mi forma ser	sadness
tengo miedo le alguien mas y se empiece olvidar mi	sadness
no le voy dejar no saludo esa noche encima dice	anger
un domingo distinto por persona          	joy
otro mas te extrano tanto          	sadness
en serio estuve con por do horas mas o menos	sadness
todo andaba bien hoy bad desde el alianza lima juega	anger
ya se fue el y tengo hambre      	sadness
y hoy no abre el ta listo      	anger
donde sera venden el carino necesito vengan un millon  	sadness
ahora esto e personal            	anger
manana entro escuela y no tengo ni cuadernos    	joy
mal puse cuando pregunto eso          	sadness
maleta y                	anger
necesito nuevos amigo              	sadness
ok kevin ya esta cabeza x salir en su cumple	anger
se parte cabeza y tengo un humor divino    	anger
te quiero aqui conmigo            	sadness
quiero ver mi              	sadness
no salgan su casa despues 2 manana      	sadness
? todos los van ser asi porque ya no quiero	sadness
cada vez pega mas parece q lucas no este siempre	sadness
ma porra                	anger
pues yo quiero tener sobrina pero se aun no e	sadness
le pasa gente igual estoy ser como      	joy
pasen rapido horas loco porque no se como he tanto	sadness
no quiero ir al medico          	sadness
buenas noches otro dia menos          	joy
dormi y levante recien ahora como odio sentirme mal  	anger
gusta cambiar                	joy
necesito traigan el cafe cama y con algo dulce  	sadness
chale sad                	joy
termine do tres series diferentes en mi vacaciones estoy muy	joy
no se si siento o soy un pelotudo    	anger
aca no dice si necesitas una misa malo chabon  	sadness
gracias                  	joy
hay gente solo necesita una excusa un para llevar cabo	sadness
quien se case conmigo tendra aguantar lo use como oso	joy
sinceramente este equipo da verguenza          	anger
estres este domingo en pijama          	sadness
se arranca el ultimo dia laboral        	joy
mi carro                	sadness
ay si estoy bien            	sadness
re podrida                	anger
no fui vega por ti y con      	joy
cada vez veo alguien en una foto con blancos dan	sadness
flor lleva su              	joy
5 pa todo              	joy
aburrimiento                  	joy
siempre lo he dicho esto e una  solo espero	sadness
mi ciudad con y yo aca        	sadness
alguien quiera venir almorzar y ver peliculas conmigo    	sadness
quiero irme casa ya mismo          	sadness
lpm quiero canciones dejen llevarme recuerdos hacen miserable    	anger
toma no                	anger
cena te verde con 2 pan        	sadness
q paja da              	sadness
ayer trabaje y el sol estuvo genial todo el dia	joy
ya decia yo habia visto ante en      	joy
no mas en ningun sorteo y mucho menos compro una	anger
puede loco                	sadness
lindo fue poder dejar mi en ese lugar    	joy
voy esa estupida cuenta            	anger
yo tambien quiero ser igual feliz        	joy
no quiero enfermarme nuevo            	sadness
como tres cuadras diaz            	sadness
un chongo entienda pido nomas          	anger
los el wifi              	anger
mo voy conocer              	joy
siempre pensando en lo mismo          	sadness
siii y duele darte cuenta cosas no son porque tu	sadness
placer vida morir risa hasta llorar mi amigo son tan	joy
pocas ganas armar valija            	sadness
hubieran sacado hermana ni e famosa se tenia quedar no	anger
y total solo tengan al espanol en      	anger
libre gordillo  siempre lo fue  o no una	anger
mal volver en el bondi con todos los pelotudos van	sadness
cuando tu novia te            	sadness
el lunes entro clases no quiero        	sadness
triste mi chica los finde lpm  necesito aca mimos	sadness
preparando los                	joy
felizsabado pa ti lo q e yo soy feliz 	joy
no no                	sadness
lindo despertarme esta hora por una crisis      	joy
q lo paso fatal durmiendo sola        	anger
no estoy lista para mi ultima semana vacaciones    	sadness
ahora estoy                	joy
por esto rio en situaciones no deberia e por mi	joy
cae mal cuando              	anger
en esto se mi eso          	joy
ver si mi amigas se pongan en modo y pagan	joy
mood con y no son desayuno        	joy
date cuenta                	anger
y parece nuevo el cerro          	sadness
donde                  	sadness
una novia como              	joy
no fue una re ufff noche pero lo importante era	joy
se                  	joy
dicha no sali ayer porque hoy        	joy
y parece veremos acostado con          	joy
si alguien se escribir fantasia aqui tiene algunos consejos  	joy
y yo como llorando  eso no falla nunca  	sadness
te tengo en mi cabeza todo el tiempo    	sadness
mi hermana le cambio contrasena mi y ahora no puedo	anger
hizo dano el              	sadness
bronca estar asi              	sadness
no quiero regresar              	sadness
asi como cuando uno toda fotos los viajes asi  	sadness
aunque le mucho interes alguien nada si el no lo	sadness
fua victoria quien ma te va por ig    	anger
hoy estuve todo el dia con el      	joy
no se si pero no esta mal      	joy
                  	joy
wow estoy tan orgullosa mi ninas        	sadness
quiero un estrella  y aun no encuentro uno [?]	sadness
le voy decir para hacer un partido hockey    	joy
e joda                	anger
una nueva propuesta gracias dios          	joy
no puedo sentirme tan para el orto      	sadness
siento harta tantas cosas y no puedo hacer nada al	anger
como vengo enfermar un lunes          	anger
era q ya no iba tomar mas      	sadness
no se puede estar en ningun lado te cai gorra	anger
manana no quiero ir trabajar          	sadness
pasapalabrachv sorry pero fui feliz con el error del sebastian	joy
caro                  	joy
siento poco poco todo va          	sadness
voy dormir                	sadness
xq pero siento q hoy va pasar algo    	sadness
necesito un                	joy
lo unico espero no se haga costumbre levantarme todos los	anger
justo habia despertado con ganas hacer un al llueve  	sadness
como si le              	sadness
no te va dar cuenta no quiero una amistad noma	joy
buen dia sabado todos aca ya tengan un lindo dia	joy
muchisimo mejor [?]              	joy
mi familia se piensa soy personal todos mi sobrinos tienen	anger
cosas tan simple mi dia          	joy
y yo nunca ser amigas por mas yo lo intente	sadness
ganas volver                	sadness
super mala educacion te pongan bien pedo y no te	anger
tu ira y tu yo viendo ropa y por lavar	sadness
quiero todos los lo una foto para verlo    	joy
tu ya verte con ninas y yo aqui con una	sadness
e ni se como sentirme          	sadness
se estan perdiendo los            	joy
esto e una sigue estilo i s i s 	anger
lpm se va bateria muy rapido        	anger
tal cual                	sadness
preguntas pero sean y respondo          	joy
en mi caso eso no preocupa otra cosa    	joy
estoy bien sad porque yo manana no regreso uni  	sadness
odio                  	anger
no mamen e neta            	anger
un bebe 7 por tanto          	joy
sabado 1030 pm y ya estoy diablos pasa    	sadness
bailando back                	sadness
escuchar algunos y te los oidos  ademas preguntarme hacen	anger
ni un minuto silencio            	anger
si tu quieres le puedes preguntar al mismo diablo no	joy
con nadie se queda bien          	anger
y no fuimos pa            	joy
solo son noches              	sadness
creo fuerte pero no soy ma debil sensible    	sadness
felices 21                	joy
encima le hemos ese dia no se en    	anger
le pregunte                	anger
un buen dia              	joy
quiero  algo para esta noche        	sadness
despues en piscina ver            	joy
lastima no                	sadness
varios cumpleanos y este dia          	joy
ayer clasico espero una tarde tranquila        	anger
ma bronca agarro              	sadness
mal levante                	sadness
quien dejo toda su familia fuera su casa    	sadness
duele el corazon              	sadness
en serio no puedo como desde hace 10 min porque	sadness
20 dia                	joy
wtf estan horribles los horarios semestre        	anger
el cerebro sabe lo le pero el corazon no sabe	joy
copado justo un domingo haga lindo dia      	joy
bueno nunca mas trato ser tierna con nadie    	anger
le dar rt y mg          	joy
nadie sabe                	sadness
estaria necesitando rocio              	sadness
creo pensar q lo vi no sea cierto    	sadness
por dios                	sadness
cuando llega una instagram cosas o siento estan diciendo bueno	sadness
q asco  siempre mi familia gordo o q no	anger
to super                	sadness
tengo el ojo horrible lo unico espero sea alergia y	anger
siento algo feo en mi corazon        	sadness
ayyyy despues estar el y mi vida durante anos con	sadness
fantasia han dejado tirada para el concierto hoy y voy	joy
lo odio por hacer el concierto hasta monterrey    	sadness
siempre lo                	anger
era necesario despertarme esta hora          	sadness
asi ayer le pusieron el como mejor opcion    	sadness
borre toda fotos tenia con el        	sadness
quisiera poder entender el porque cosas        	sadness
camisa s y camiseta l y m ultimas quien quiere	joy
buen domingo                	joy
como hace falta serie luis miguel        	sadness
no gustas agosto              	sadness
pues bueno sabia              	sadness
irse vacaciones conocer un chico en el hotel y saber	joy
se puede decir mas alto o mas bajo pero no	joy
desastre como esta jugando u          	sadness
dios quita pero cuando            	joy
no termino salir una y ya dan otra    	sadness
cuando voy aprender no debo esperar nada nadie nunca pero	joy
si matar fuera legal no estaria llorando los nervios  	anger
ganas estando                	sadness
veces trabajar hasta tan tarde y no haber visto el	sadness
tanto espere el sabado para nada        	anger
el aburrimiento dan ganas hasta llorar        	sadness
hacen sentir especial              	joy
como estar enferma              	sadness
"por dicen "" recuerdo ""  no      "	sadness
veces tengo tan bien corazon por eso estare sin cel	joy
lo mal q m siento          	sadness
se terminan vacaciones  donde saco ganas para volver cursar	sadness
favor del aborto clandestino            	anger
estas alturas y yo sigo poniendo mal x lo mismo	sadness
ganas un helado              	sadness
mi familia e cool en dosis pequenas      	joy
extrano estar con mi familia          	sadness
? como                	anger
tal vez no te pienso pero no te olvido tal	sadness
hacen los ahi por favor          	anger
ojala sea posible              	joy
ya no puedo esperar para ser independiente y subir mi	joy
dia lpm y yo aca          	sadness
igual todo lo              	joy
y otro para fran            	joy
hoy va ser un gran dia        	joy
estaba muy y fui al mall y di cuenta ropa	joy
envidia da gente come y no un verdad    	joy
e poco                	anger
esta en oreja  ke          	joy
por mas intento estar ya no puedo      	sadness
quiero ver jimin con el pijama porque se super tierno	sadness
padre manana entran los nuevos al lo yo por estar	sadness
hola te extrane nada            	anger
voy seguir                	anger
por aca todo              	anger
no quiero entrar escuela            	sadness
seguir sufriendo entonces              	sadness
bien cae gente entiende como se usa twitter    	joy
un dia eres joven y el siguiente te mal por	joy
bonito e saber razon  ahora si se venga paz	joy
yo lo se e esta foto va partir el alma	sadness
no olviden los se han en esta      	joy
eran 6 ahora son 9          	sadness
mi accion buena del dia fue darle comer los perros	anger
chido e en tu calle un puesto dulces y  	joy
ganas dormir con negra            	sadness
siento si esto sigue asi seria una mentira para los	sadness
el mismo error constante un paso adelante y do atras	sadness
no los leo los buenos dia  ptm ya tengo	joy
laura gustaria mi mejor amigo ser mi mejor amigo  	sadness
tierra trague y en alguna piscina        	sadness
hoy e uno esos dias en los no ganas salir	joy
no hay nada para el calor con una y peli	joy
para voy repetir lo mismo dije semana pasada    	sadness
cara                  	sadness
siempre quise tener una hija para comprarme cosas y decir	joy
look                  	joy
extrano tanto                	sadness
necesito un abrazo              	sadness
yo tengo muy buena suerte en mi do van ninos	joy
como se le hace para no extranar alguien    	sadness
no pongas prueba mi paciencia porque e      	joy
un par piernas nuevas por favor hace del lunes tengo	sadness
quiero otra serie como merli          	sadness
lo bien estaba yo hoy en playa y hacen ir	anger
volvi triste pa mi casa xq no tuve tu beso	sadness
volvio                  	joy
no puedo llegar              	sadness
no quiero pasar en mi casa toda tarde con dia	sadness
estoy tan enojada y triste vez cansada pasar estas cosas	sadness
muchas cosas por mi mente          	sadness
cago en youtube              	anger
mal                  	sadness
mi novio se va medio dia y yo asi no	sadness
esas veces necesitas un abrazo largo        	sadness
esto queda experiencia debo seguir salidas gente porque siempre se	joy
paja volver rutina              	sadness
fui dormir del orto y levante peor      	anger
volviendo nacer                	joy
en mi corazon gano toluca          	joy
no se leyendo esas cartas          	joy
? como esta hora            	sadness
? quien se le ocurre llamar una junta en sabado	sadness
va                  	joy
ya no se como empezar pero pues ahi vamos desde	sadness
quiero una torta              	sadness
no quiero irme aqui            	sadness
luego ganando el casi se lo gana con sabor tristeza	sadness
ya                  	sadness
ultimamente son solo noticias malas          	sadness
haber                  	joy
nadie quiere estar donde no se siente bienvenido    	sadness
vamos dar una vuelta            	joy
se fue el finde y no hice nada lo queria	sadness
26 en 24 hr en cd        	sadness
fumo                  	sadness
alguien al esta bastante aburrido          	joy
ya lo dijo  jajajajaja          	sadness
mi crush no habla            	sadness
esta empezando gustar              	sadness
muero sueno                	anger
menos mal faltan 7 dias para noma      	joy
estoy un tener 500 ? por ex      	sadness
triste pone no tener con quien compartir algunas cosas  	sadness
ya no quiere mas            	sadness
se puede llorar tanto x una pelicula      	sadness
intente cambiar una mi por una nueva y falle rompi	sadness
no quiero hacer maleta porque no quiero ir    	sadness
noche tan triste              	sadness
manana quiero playa  pero tanta noticia tienen en panico	sadness
siento triste                	sadness
ya va el otro            	joy
siempre e misma              	sadness
usted se puede una pija          	joy
triste haya gente tan poco profesional no le dieron  	sadness
mi                  	sadness
se                  	anger
estoy tratando dormir pero no puedo  lo peor e	sadness
bueno ya esta vamos empezar vuelta otra vez    	anger
un dia eres joven y al otro te levantas 500	joy
yo soy el izquierda gracias          	joy
e mi ano fuera casa y sigo poniendo triste cuando	sadness
v 9 pm hora local el equipo se hoy color	anger
hoy voy o voy echar menos        	sadness
hasta cuando podre volver dormir          	sadness
cada comentario boludo hay leer dios alguien saque los ojos	anger
jajaja buena onda              	joy
bajon no puedo escuchar musica en el      	anger
quiero playa y mi novio gracias bye      	sadness
el donde esta              	sadness
lit e muy no tener quien contarle mi situaciones y	sadness
quiero hacer algo              	anger
y ahora estas tu sin mi y hago con mi	sadness
pero voy pa '            	joy
triste e no poder comer nada con lo ricas son	sadness
rompe bola se pone con venir cuando tengo estudiar  	anger
buenos dia tengas el dia mereces        	joy
o cuando el al equipo musica        	anger
quiero salir                	joy
pense todo habia quedado en el olvido hasta hoy el	sadness
4am hora sale el up le unos y para ayudar	joy
no puedo gane el            	anger
pedazo pelotudo                	joy
esta hora y yo pensando en hice mal    	sadness
con esta situacion no dan ganas ni cama    	sadness
diez anos chocolate no vienen mas y mama viene meter	anger
necesitaria un consejo y un buen abrazo nada ma  	sadness
apenas van dar 11 y ya estan por mi casa	anger
ver si echar y y vamos poco poco limpiando el	joy
mejor hubiera quedado en casa          	sadness
extrano                  	sadness
3 dia                	anger
creo los 22 millones tiene manuel he sido yo  	sadness
tal vez sea lo mejor          	sadness
se todo seguia pedo            	sadness
corre y va nuevo            	joy
pobre mi novio con tanto cambio humor ya no tarda	sadness
control calidad esta volviendo loca y apenas llevamos una clase	sadness
y energia                	joy
q lindo finde gracias por tanto        	joy
mi dijo q asi parezco mujer algun si q e	sadness
linda ya e              	sadness
odio tener q hacer cosas por lpm      	anger
lo rapido puede cambiar mi humor e impresionante    	anger
alguien para hacer tour empanadas por el barrio    	sadness
mi solo importa alguien ni quiere presumir      	sadness
ahora va dormir toda tarde          	anger
ya no quiero perderme tratando nuevo        	sadness
yo pensaba nicolas maduro estaba en porque se habia muerto	sadness
quiere llevar plaza  adivinen quien se quiere matar  	joy
rubia aca conmigo              	sadness
menudo esta dando              	sadness
en mi top estan el papa y  queria  	joy
no se no haga extrano maduro los drone con fueron	joy
odio los tocan musica en los no dejan comer bien	anger
como caga no conteste si esta en linea    	anger
duro e esto              	sadness
se re pego el tema del marginal      	anger
ojala este                	sadness
pues listo                	joy
esa calma ante del caos          	joy
estaba abajo mi cama            	joy
vamos tener ir              	joy
no anda bien internet y no puedo jugar en linea	sadness
no dire nada pero            	joy
tanto perdi del mundo del ahora e      	sadness
pesar con lo paso con imagino e muy duro perder	sadness
siempre va encontrar              	joy
feo e no tener tu telefono aunque nadie te hable	sadness
este chabon tiene menos huevos yo  lo odio con	anger
soy una mala persona            	sadness
mega                  	anger
lo peor del domingo e decirle adios al    	sadness
son tantas fotos boludo            	anger
por mas dias como ese          	joy
al final el pajero del fran no hizo nada lo	anger
lo q sea por un masaje        	sadness
estoy muy wey para indirectas          	joy
hace el 40 por favor termine ya el partido  	anger
hoy te vi ya lo se pero algo en mi	sadness
ya vienen y yo sigo sin saber bailar    	sadness
miren e lunes y ya tienen todos pelota por el	joy
hasta el sueno se paso con el miedo hizo pasar	anger
odio gente sea muy y se quede viendo nunca han	anger
ir caminando y su olor porque una ella uso  	joy
podria haber sido un domingo pero no      	joy
ganas un abrazo suyo en este        	sadness
no quiero sea manana            	sadness
si por tu culpa fue          	joy
tambien estan e vaya caida          	sadness
no se si llorar o          	sadness
en sombra debilidad              	joy
siento nunca lo voy superar          	sadness
compre el disco para ir          	joy
queria seguir durmiendo calentita en mi cama      	sadness
ahora en mas todo sera por mi y para mi	joy
haces si en tu casa no hay accion pagar  	sadness
todos deberian entonces tener esto tiene acabar      	anger
pls                  	joy
gusta torta con con pero mi dame lo clasico con	joy
adivinen quien y comenzo llover  hermosa e vida  	joy
tu pinta sonrisas en            	joy
luna                  	anger
urge el cabello              	joy
hay noticias uno nunca quiere recibir no puedo    	sadness
hace como 40 anos no tengo relaciones      	anger
yo solo quiero un novio lleve siempre playa tanto pido	sadness
si para el miercoles no llega el voy tener hacer	joy
justin no tiene hermana            	sadness
el mal humor estoy manejando          	anger
dificil e despues tanto tiempo y no poder evitar sonreir	joy
yo con una amiga cago por pendeja      	joy
cuando familia se sienta y todo lo le sabes donde	joy
flaca y etc              	sadness
todo el mundo habla vez yo esto no lo entiendo	joy
le estoy dando demasiado amor persona y estoy quedando sin	sadness
esto tiene harto hasta el punto mismo odiar y sonreir	joy
yo solo quiero dormir  no sean dormi casi 4	sadness
por 5 segundos vi una cana y casi muero un	joy
volvi pobreza por tener empezar escuela manana      	anger
si te con el pie baila con el derecho  	joy
no doy mas del sueno          	sadness
maldita sea justo cuando decidi dormir hablan      	anger
crei hablar                	sadness
trabajar un                	anger
y si no queres soltar ese pasado porque esta lleno	sadness
mi derecho mi decision y porque da gana ser feliz	joy
pone tan mal cuando no llego todo      	sadness
odio porque no se ve ni ma y no puedo	anger
tener joder quien no jodio y no hacerlo eso e	joy
cancion tanto se pego            	anger
8 anos cuando tuve uno estos        	sadness
quien mando venir al centro lleno por todos lados lpm	anger
empezamos semana con una mas al       	joy
o mas incomoda tambien            	joy
sabado ma aburrido              	sadness
ganas comer arroz con leche          	sadness
entre menos hable mejor ya quiero sea lunes    	sadness
increible e cuando todos            	sadness
voy seguir pidiendo q regrese al rosa hasta q lo	sadness
extranaba esos mensajes              	joy
edad se olvido ti pero todo bien      	joy
no podria ser porque amo el helado en especial el	joy
se su y arranca como titular        	joy
cuando creia era feo            	sadness
volvi y ya no estaba en el equipo    	anger
di cuenta q necesito q amor        	sadness
okay debo aceptar cuando estoy un poquito pongo un insoportable	joy
aburre ver una serie sola          	sadness
ya canse esperar te si te va o te quedas	joy
decidi ya no por descubri no puedo mi vida en	joy
quiero seguir aqui alla pero mi pie ya no dan	sadness
tan complicado conseguir alguien para ir merendar plaza    	anger
bien mi vuelta              	joy
todavia no se si en venden el ese puneta ustedes	anger
no se si mi dentista quiere pero en un quitan	joy
no sale ni una bien con esta mina    	anger
ojala alguien vea asi            	sadness
un dia junto mi amor          	sadness
hay un gatito llorando afuera mi casa y verdad quiero	sadness
en fotos deberia verme como veo en los    	anger
otro titulo                	sadness
estes e el problema            	sadness
por pasta vale todo hasta nuestras vidas      	anger
no se explica lo terrible estuvo mi noche    	joy
vivi lo te quieres llevar          	joy
ayer pense en serio iba morir entre tos y dio	sadness
