text	label
yo cada viajo              	joy
con esta va dormir            	anger
nadie te merece pero asi e esto del amor  	sadness
esta hermoso el dia y yo        	anger
se fueron e pura            	joy
como los donde tu eres son medio      	joy
sigo por lo campera            	anger
manana entro universidad              	sadness
oye contigo soy feliz en serio        	sadness
esa verguenza post instagram esa          	sadness
gustaria poder guardar todos estos sentimientos en una caja bajo	joy
para mi                	joy
volvi iglesia                	joy
unos usan el para olvidar y yo ebrio hasta en	joy
estoy tan feliz con el grupo mi companeros trabajo 	joy
sera lo extrano              	sadness
""" asi e se como un sueno pero fotos no"	sadness
mucho persona                	sadness
hice un buen trabajo este fds ahora entiendo todo el	sadness
y aqui vamos otra vez          	joy
desde luego                	joy
dia 7 no hemos hablado mucho        	sadness
ya extrano mi gusta quedarme sola        	sadness
en mi vacaciones del trabajo lo unico he hecho e	joy
odio persona lo unico saben hacer e      	joy
nunca nada ahora esta ropa vengo        	anger
ah cabron ahora el facebook publica en mi twitter no	anger
para no tener              	joy
esto e el colmo en serio sube pero nosotros tienen	anger
? hay algo mas triste ir por una pasta dientes	sadness
yo como gorda pero feliz          	joy
muy lindo finde no puedo quejar        	joy
mi novio ya vio los meme del mundo    	anger
y mi karma con esto e tan grande mi y	joy
cono bro                	sadness
se hace el corazon chiquito          	sadness
se lo diganme q si          	joy
baja un ratito abuelo            	sadness
pinto ese y esos verdes con el amigo    	joy
domingo peli y pensamientos            	sadness
estresa no tener nada para esta noche      	anger
como pasaron tan rapido vacaciones          	sadness
lista para cambiar el amor mi vida por otra vida	joy
quedare con esto punto            	joy
no puedo sentir peor lpm justo hoy      	anger
momento en el llegas trabajar casa ducha mono pijama cena	joy
queria tanto ta na            	sadness
tres horas y lo unico hacen e darse vuelta y	anger
ojala                  	joy
hola perdon te con mi nude        	sadness
tengo dejar pensar boludeces            	sadness
lo mas prudente y puedo hacer ahora e ir al	sadness
quiero un pinche pollo alv          	anger
bueno pesar pasar toda semana mal aun el curso ya	joy
y seguimos trabajando en paciencia          	sadness
no entienden nada              	joy
ojala alguna noche pueda dormir sin despertarme tantas veces  	anger
esta semana no tendre descanso          	sadness
mi e                	joy
el se fue  aunque lo veia venir presiento despues	sadness
tan facil e dejar en paz tus parejas y asi	anger
ya estoy empezando eso pasa por sentarme lado    	sadness
hace cantidad no te veo todo bien con vos  	joy
esa maldita costumbre dormirme en el tren y    	anger
se parte cabeza llorar todo el dia cuando tiene estar	anger
y veremos no este sabado muy buen dia    	joy
dia tan triste              	sadness
un finde ma no alcanzo respirar ya e domingo noche	anger
lata wn                	sadness
no te                	sadness
ya no solamente e un pais caro para el ahora	sadness
free uf                	joy
ganamos                  	joy
amo este pais habia olvidado lo rico e estar aqui	joy
se rie cosas digo            	sadness
e horrible no poder segura ni en tu propia casa	sadness
aun siento mal por soy peor persona      	sadness
servicio mas el del internet en este pais    	anger
todo lo te haga feliz vale pena      	joy
agosto con soy un gordito bueno        	sadness
mi misma                	sadness
wea no e ser wea e ser feliz    	joy
re perro                	anger
ya salto con              	sadness
amor e atencion tiempo y calidad        	joy
leo                  	joy
mono eres hijo mio            	sadness
no quiero entrar              	sadness
justin                  	sadness
como no  my dona          	joy
empiece el juego              	joy
acaban descubrir mi plan            	sadness
no se serie empezar            	sadness
odio nada ni nadie puede hacerme sentir bien    	sadness
soy tan feliz              	joy
ya estaria poniendo mal humor          	anger
voy cancha mi madre bronca loco        	anger
e tan encontrar alguien con tienes mucha pero al final	sadness
entre en depresion con los snap goal e y yo	joy
despues muchos anos se puede el oro e bueno  	joy
aburrimiento tengo                	sadness
ya manana se acaba el          	sadness
lo odio muy mucho            	anger
feo e este enfermo y no poder quedarme    	sadness
cuando tienes cara              	joy
si no e no e justicia        	anger
soy tan sensible pone mal si el esta mal  	sadness
nada peor llegar casa pensando en milanesa dejado y no	joy
hace dano porfa              	joy
subo o no subo el video        	sadness
malditas ganas besarte y no poder        	sadness
no te creo nada            	joy
y por el pueblo            	anger
di tambien estaba perder 1 0 tapia      	anger
necesito amigo nuevos quien se          	sadness
lo extrano mucho              	sadness
dificil e ver tu senora madre triste y no poder	sadness
toda tarde con sueno y cuando quiero dormir no puedo	anger
yo tengo ma un alguien hacen mi vida mas dulce	joy
y si son 12 am por favor      	joy
tengan todos los lean este mensaje lo mejor vida deseo	joy
se darle un abrazo sonriendo          	joy
yo tratando hacer toda tareas puedo en el fin semana	joy
cansada estoy                	sadness
verdad fue una buena platica          	joy
pinche trafico                	anger
usar una vez y            	joy
ok ni hablemos los video y los di para mesa	joy
24 horas irme pasan estas cosas        	sadness
he ido playa por tarde y verdad lo mejor pa	joy
pesadilla otra f              	sadness
extranando                  	sadness
y donde esa pendeja lo mato alv pinche fea  	sadness
con primo como nahuel pa quiero        	anger
hacer hacer hacer y seguir haciendo        	joy
con una                	sadness
podrida estoy                	anger
necesito un abrazo y solo tu lo puedes dar  	joy
fuimos al encuentro con y no ganamos una bolsa  	joy
? se acuerdan hace una semana ya queria entrar escuela	joy
hoy quedo en casa calentita          	joy
triste noticia fui al desde jardin        	sadness
si pudiera los todos            	sadness
descuidas do minutos y ya estoy comprando un pasaje para	joy
enferma si tenes alguna duda preguntame        	anger
rico e despertarse esta hora          	joy
si senor veces puedo ser muy hp      	anger
he levantado como una y se han pocas ganas tenia	joy
no quiero el miercoles en noche llegue      	sadness
e increible esta hora no puedo seguir durmiendo si no	joy
abrir insta ver una foto y wea se despues paso	sadness
pero no te importa no te importa nada q haga	sadness
va hacer otro hermoso dia          	anger
al el fondo pantalla al telefono 5 veces por dia	joy
fue un placer contigo en esta vida      	joy
ahorita ando llorando gastritis pero ayer bien con sus cervezas	anger
ta ya esta ya siento mejor        	joy
pregunta seria le hablo al hombre del estoy enamorado para	sadness
estoy re                	sadness
en vida todo e y cada cosa y trae su	joy
lo unico lindo del franco e poder hablar con mi	joy
ele seguia                	sadness
mate y facturas con mi familia mi mejor domingo  	joy
extrano                  	sadness
parece hasta te gusta hacerme sufrir        	sadness
ganas sentir le hago bien y soy para ella  	sadness
y por cocinar              	joy
mi team trabajo ya estan por estoy comiendo carne en	sadness
quisiera ver los estos juegos el al companero adelante y	anger
ok ya tengo irme aqui estoy 2 cambiar mama  	anger
le mando mi papa para decirle algo no quiero escuche	anger
solo quiero una llamada no llegara nunca     	sadness
mi cumpleanos con amigo            	joy
duele una banda el estomago          	sadness
mi corazon y  buenas noches        	sadness
sigue chiste                	sadness
no le queda otra ya en argentina no le hicieron	anger
ganas estar ahi              	sadness
no debi haber visto nunca infinity war      	sadness
cagada pana                	sadness
belleza e mentira busca en el corazon      	joy
no molesta eso              	anger
porque verdad duele tanto            	sadness
no estoy llorando              	sadness
equivoque                  	sadness
noche puro netflix y helado con mi      	joy
rehuso comenzar clases manana  esto e injusto    	anger
pregunta seria ? cuanto dura un guayabo      	sadness
este se cumple un ano mi max lo extrano tanto	sadness
buen inicio semana todos            	joy
santa paciencia quiero ver el y nada mas hacen poner	anger
? alguien sabe donde o perros sean chica    	joy
partio el alma              	sadness
un hombre mayor acaba decir ojala mi belleza dure anos	joy
asi querias ser presidente se quede en el casa mejor	anger
y culpa tiene el ignorancia humana hdp      	anger
encanta este libro y recien lo empiezo      	joy
dormi ante y ahora estoy entre dormida y despierta pero	sadness
si no ya no e mi problema      	joy
hacer mia y listo ya          	joy
no puede haber un poco alcohol en mi casa por	sadness
lo q faltaba para completar el        	anger
llegar tu casa y no tener sueno y no tener	sadness
sera hace un monton no extrano nadie      	joy
quiero irme lejos estar solo          	sadness
buenos dias crush cumple manana          	joy
vueltas dan mucha vida            	joy
no puedo dormir              	sadness
lastima perdi seguidores              	sadness
onda pa eso hay tenis esos son      	anger
siento siento no hago lo correcto siento aqui no soy	sadness
? conocen alguien sepa hacer en        	sadness
gracias dios no en pc ayer porq siempre comen oreja	anger
ya empezaron otra vez quitar maldita luz      	anger
el cambio sin tanto drama lo e pa su e	joy
el y yo partir hoy          	joy
tal vez en otra vida          	sadness
estoy muy sad ahora mismo          	sadness
mi lleve el diablo            	sadness
mi le dijo mi hombre hiciera una prueba por tenia	sadness
quiero esta triste realidad            	sadness
con  tu              	joy
ya esta bien pues total no hagas caso y re	sadness
hermoso dia y yo encerrada en casa con una resaca	sadness
encanta pasar tiempo con mi familia [?]     	joy
este esta jodiendo              	anger
quiero ver los increibles 2          	sadness
boludo so rodrigo              	sadness
rompi el miedo y hoy voy dormir un poco mas	joy
quiero mimos lpm              	sadness
un fin semana no e suficiente        	sadness
estoy do hacerlo              	anger
i ron y pa este dolor tan      	sadness
estoy necesito tanto un abrazo          	sadness
hay                  	anger
eu todo el mundo piensa le hablo mal y but	sadness
estoy esta situacion              	sadness
pizza y                	joy
internet  cada vez anda peor        	anger
estres no puedo dormir justo un dia ante entrar facu	anger
primer dia playa y ya he los pie y los	joy
quiero ir                	sadness
quiero taco san              	sadness
volvi                  	joy
miercoles no pinta como posible buen dia      	sadness
levante contenta y asi hasta vi mi cabello en el	sadness
buena serie porque nadie lo dijo porque      	anger
vamoslau despues ver este partido doy cuenta q los do	sadness
voy llegar casa tarde encima hoy vuelvo laburar    	anger
odio tener rogar para mirar una peli lpm    	anger
sabado paseo familiar              	joy
y ese tal todavia le queda cara hay q ser	anger
mi vale yo manana voy ir escuela      	sadness
ya volvi enfermar              	anger
hace falta como una foto nueve y      	sadness
no quiero ni imaginar lo va ser mi pelo cuando	anger
bronca cuando mi amigas quieren ir atras una pija y	anger
ando muy alegre              	joy
facil                  	joy
alguien para hacer algo            	sadness
quiero banarme comer y dormir tres dias      	sadness
te extrano                	sadness
en fb aparecen publicaciones cada otras do publicaciones    	anger
no estaria pasando nunca            	sadness
sad san miguel              	sadness
automaticamente un man cuando escucha decir mi     	sadness
ya en tus para vea bien los pero no  	sadness
extrano demasiado los domingo asado mi viejo en casa 	sadness
rio si e un rio          	sadness
estoy entrando en una lleva el diablo      	anger
el ultimo dia vacaciones lo termine rompiendo mi pantalones al	sadness
desde se fueron mi sobrinos duele cabeza todos los dias	sadness
podemos junto                	joy
buen humor               	joy
lo se se              	sadness
buenas noches manana seguir trabajando en casa mi princesa  	joy
solo espero no sean malas noticias        	sadness
seria mas facil si no te tan lindo conmigo  	sadness
hoy decidi voy ser feliz fuerte y todo no por	joy
ya no e lo mismo ya di cuenta no queres	sadness
cuando vuelvo clases y veo mi y amiguitos [?] cuando	anger
tan linda noche y yo encerrada        	sadness
tan cerca y tan lejos te echo tanto menos  	sadness
niego seguir los niego tener poner alarma 7am    	anger
algo peor no disfrutar con familia por culpa del trabajo	sadness
cara                  	anger
verguenza                  	sadness
rabia wn por favor no el fin semana    	anger
so no                	sadness
tan hermoso lo habian dejado          	anger
como cuesta                	sadness
tengo sueno                	sadness
manana tengo do pruebas y no estudie      	joy
tan real duele              	sadness
felizsabado sonrisa en sale del corazon y en boca  	joy
hoy desperte con ganas hacerla pedo        	joy
empieza molestar                	anger
tengo tanto trabajo              	sadness
mate y facturas              	joy
estoy hambre                	sadness
parte traen el reggaeton todo volumen        	joy
tu vida                	sadness
sone estaba comprando zapatos y el celular sono justo ante	sadness
prefiero no mirar quien ve mi porque cuando lo hago	joy
andres cepeda letra              	sadness
da demasiado miedo andar en un carro madrugada no sea	joy
este e el fin el          	joy
hora levantarse por comida            	joy
voy tener otra cosa porque el amo no e lo	sadness
ni ano por victima barato sale matar en algunos casos	sadness
no mas                	sadness
ahora e                	sadness
se olvido mi cartera se 5 pa el metro si	sadness
un fin semana completamente y lleno no arrepiento nada  	joy
bueno duele el cuerpo            	anger
realmente debe estar bravo conmigo aunque le da tan igual	sadness
feo sentimiento                	sadness
mega caga los hombre con los  o sea no	anger
bue mira por lo q foto perfil      	sadness
si alguien se pal mac          	sadness
por ponen su celular en modo avion      	anger
come uno y al rato ya        	sadness
estaba tan mi cama            	sadness
ustedes no saben el da cada vez subo una historia	anger
si                  	sadness
no se porque da sueno cuando no tengo con quien	sadness
una semana                	joy
chale si fueron alto sin mi        	sadness
mucho jode este nene            	anger
lo mejor uno puede leer un lunes 9 am  	joy
soy esas persona si el closet esta siquiera un dedo	joy
asi soy yo              	sadness
el tiene                	joy
q saco                	anger
corazon tan pero tan tiene esta senora      	sadness
le pasa si una prima no te tiene en whats	sadness
mi mas en mi lo yo quisiera  lo siento	anger
ahora si ya estoy sensible mejor regreso mi casa  	sadness
una pelicula plis o            	joy
mi nariz                	sadness
nadie para los mate            	sadness
not bro i wa in 10 pm  hijo santa	joy
bue unas semanas y el combo del dia en el	anger
posta con sofi deprime porque cuando no esta no se	sadness
quisiera poder jugar wow            	sadness
el semestre pasado escuela y este pues apenas y estoy	joy
preocupa                  	sadness
como un simple mensaje cambio manana        	sadness
necesito un ella urgente            	sadness
una ganas jugar futbol y no puedo      	anger
mamada                  	anger
e gracioso pero pasa con do siguen      	joy
siempre lo                	sadness
otra vez sin foto y sin  no voy cambiar	anger
vida e bella              	joy
saco                  	sadness
hay dias en los pregunto si fue decision correcta  	sadness
ando escuchando disco ni acordaba los habia escuchado nostalgia  	sadness
ni tendria extranarte onda conmigo          	sadness
el peor dia mi vida un dia como hoy todo	sadness
gracias todos los se el tiempo y pasar este dia	joy
hoy hace 1 ano            	sadness
? por odio y una persona si puedes    	joy
mate se toma todo el dia todos los dias  	joy
el chiste cuenta solo            	sadness
entrar nuevo trae muchos recuerdos y llena nostalgia    	sadness
ire gente                	joy
para acorde loco ahora voy hacer cabeza e resto del	anger
abuelo gracias por el mejor papa del mundo   	joy
feo cuando no salis y te cuentan lo piola estuvo	sadness
espero este comiendo bien y se muchisimo      	anger
esta mas tranquilo familiar            	anger
dicha lo no alcanza            	sadness
verdad si  y sus          	sadness
acordar vaya nuevo una fiesta asi        	anger
tengo dejar sacar mi cuando estoy con no gusta tener	anger
pues llevo 12 horas tarea nada raro en epoca y	joy
mami e hoy cuando ma necesito un abrazo tuyo  	sadness
fastidio con esa gente los pie al caminar    	anger
como no voy tener wifi ni linea      	anger
ahora tengo subir peso no subo ni 1    	anger
creo te voy odiar vos y tu      	joy
6 dia                	joy
para mi esta re lindo el dia      	joy
e cierto uno no debe por pero ese par persona	sadness
no le deseo muerte solo no se      	joy
le dije mi mama 10 estaba en su casa todavia	joy
odio                  	sadness
enferma ver en cuentas twitter nada mas porque si yo	anger
del orto se hace voy cagar pinas      	anger
gran error                	sadness
como te extrano libertadores            	sadness
parce tras del hecho uno le sale gente    	anger
para muchos no serum gran cosa pero para mi y	sadness
to                  	sadness
como voy hacer para dormir solo hoy      	sadness
grabe                  	anger
y no merecen menos            	joy
mi meta e bajar 15 kilo en 3 amp lo	joy
ademas terminar entender no todo e malo y todo puede	joy
nunca ni con el rosa guadalupe        	sadness
cuanto valen unos drone quiero hacer una      	joy
ganas hablarle y todo vuelva ser como ante pero se	sadness
necesito mucho como ayer            	sadness
decepcion cuando para tantas persona se terminaron re cagando en	joy
hoy se y estoy un 40        	sadness
seria mi vida si no tuviera mi abuelos    	joy
urge alguien para coger despues ver estoy muy    	sadness
supongo si nunca he amado una pareja      	joy
mal                  	sadness
se ya estoy vieja porque por mas veces le he	sadness
ante nadie le dio un para        	anger
gracias por decirme todo el mundo salio mientras yo estaba	joy
mi novio y yo hicimos buena obra del dia con	sadness
no puedo con gente se queja por todo y no	sadness
algo se tendra              	sadness
ojala bien                	sadness
hay persona llegan tu vida para quedarse definitivamente    	joy
mucho ingles mucho ingles y tienen unas faltas ortografia terribles	sadness
vuelta                  	joy
se taller sobre como salir en ellas y volver salir	joy
en este momento estaria odiando          	anger
porra                  	anger
si e verdad los ninos hasta pueden el mal rato	joy
no se da cuenta deje todo parece      	anger
estos minutos ante 700 pm se hacen      	anger
animo esto e muy injusto con todo el trabajo tan	joy
no entiendo ya              	sadness
en verdad lo extrano demasiado y mi hermosa    	sadness
acorde del final the y puse triste      	sadness
mal                  	anger
soy del mundo              	joy
no                  	sadness
necesito hablar con alguien  urge        	sadness
no estoy llorando se metio un si te queria ver	sadness
gracias por como toda vida basura eres      	joy
ahora siento mal mi amigo este esperando 5 anos el	sadness
? porque e tan dificil subir peso      	sadness
queria al menos mi ya tienen un color mas  	joy
en valencia podria ser el titulo una novela pero no	sadness
ahora si e oficial sin barba hasta nuevo aviso  	sadness
da bronca le salga todo mal jajajaj      	anger
20 in day se no esta poniendo viejito ya  	sadness
solo horas para se vaya          	sadness
para mi y yo no hablo con muertos    	joy
"hoy en mi recuerdos facebook un "" mi amor """	sadness
le el dedo chiquito            	anger
siento amor al e todo lo vivo      	sadness
siempre dejando todo ultimo momento          	joy
por favor y gracias            	joy
no estuve en para el cumple mi abuelos algo mas	sadness
largo se va hacer este          	sadness
e tan hermosos este video por chucha      	joy
ojala el futbol como ti te gusta para bebe  	sadness
lindo despertarme y tener esos msj        	joy
hoy juego y duele el tobillo lpm      	sadness
ese era el barca            	anger
todavia ni entro clases y ya cambiarme manana    	sadness
hoy estuve en y le regale una camiseta    	joy
tengo un companero habla espanol ingles frances y aleman y	joy
quiero irme muy lejos y mi viejos por un tiempo	sadness
yo queria hablar con el          	sadness
algo esta pasando              	joy
asi como cuando tu telefono se un video especial y	sadness
quiero facturas                	sadness
el piercing dormido toda almohada con sangre deje    	anger
lo estaria necesitando un abrazo          	sadness
ay no pongas esa amo mucho [?]      	sadness
hey por si lee esto te extrano      	sadness
en horas no se dia porque no se mas y	sadness
ya manana quito barba            	joy
pense se estaba remera en foto jajaj casi   	joy
no espera estos 4 anos          	sadness
y yo aqui en chinga          	sadness
el destino se              	sadness
no existe peor sensacion            	sadness
molesta hable mi jefa no ve estoy     	anger
bien los pibes hoy ahora dormir        	joy
debo mas ultima vez te vi        	sadness
mi crush maldita              	anger
lindo dia para estar tomando mate e una plaza y	sadness
genial te y seguir adelante con el proceso    	joy
recien despertando                	joy
ya lo han encontrado ! muchas gracias todos los  	joy
necesito mas amigo como dejar el        	joy
pesar todo hoy siento va ser un buen dia  	joy
 bueno esto e para importantes para mi y para	joy
veces cambios son buenos            	joy
ahora ya estoy vacaciones y ya estare mas tiempo aqui	joy
todo muy lindo con alla un bebe en casa pero	sadness
decepcion                  	sadness
el sol pone buen humor          	joy
serio ya no quiero tomar          	joy
e esto                	joy
justo mi cora ahora            	sadness
todos los dias acuerdo mi gata  ya ha pasado	sadness
casi termine bien un dia eso ya e todo un	joy
yo tampoco estoy preparada            	sadness
? se hizo el            	sadness
perdon vecinos yo tambien mi madre si un carro no	sadness
esperando ver soledad en los 50 mirtha      	sadness
diosito solo te pido mi abuelita dure con nosotros mas	sadness
no se si tengo o soy el mismo idiota en	sadness
extrano sentir tu piel            	joy
espero cosas no van            	sadness
ahora estan porque son asi          	joy
asco vida dia existencia y todo        	sadness
como odio y pone mal humor ver el auto  	anger
yo ya habia planeado nuestra boda pero no y asi	joy
como odio estar asi            	anger
diablo fuerte                	sadness
recien llego mi casa y estan toda tengo dormir en	anger
alguien quiera un mi cuenta spotify mil e mi cuenta	joy
tenia muchas ganas parte fuerza pero con todo lo q	sadness
ma no puedo ser una          	anger
hasta esa suerte voy tener          	anger
ahora si ya se puede esta cosa      	joy
un estomago                	sadness
yo pq soy solo un          	sadness
te llame un 24 para si ibamos ir al cine	sadness
no sea tan              	joy
ya extrano                	sadness
para si sabes con esa voz enferma tenes gracias hermana	joy
esa no fue manera            	sadness
5 anos  y te extrano como nunca    	sadness
acabo ver una un perro se parece demasiado al mio	sadness
ya no quiero sentirme asi          	sadness
sueno tan                	sadness
yo no veo lo            	anger
mi talento e sentir y decir cosas bonitas para se	joy
bueno ya puedo ir esta gripe se acerca el finde	anger
buenas noches manana arranque una semana        	joy
ya tu sabes bb            	joy
no se porque estoy sintiendo nuevo esto      	sadness
caga vayan e ir en va perdiendo      	anger
ya dio pereza salir            	sadness
triste                  	sadness
yo siempre duermo mal            	sadness
ya el capitulo 4 el 5 falta el 6 y	joy
con esta calor no se puede dormir      	anger
caga engordar  manana comienzo con puro agua simple y	anger
? varias ninas al mismo tiempo hijos toda su madre	joy
del marginal  micaviciconteig micaelistas kcaargentina        	joy
cada ano se hace ma larga epoca examenes    	sadness
hubiera pasar este dia contigo  [?]      	sadness
ahora si ya e ya          	anger
saldre caminar en noche asi mas mi mente    	sadness
extrano                  	sadness
manera perder el tiempo con el        	anger
excelente programa con un lindo final  lugaresquehablan    	joy
hago todo mal              	sadness
cd no puedes dormir y f twitter como una 20	joy
ya aprendi aceptar estando asi en puedo ser    	joy
no te con estoy            	sadness
esto dormir en el y tener despertarme x cualquier ruido	anger
e buen                	joy
callate eran 9 cuando conoci          	sadness
este telefono anda un por nada y lo contra pared	anger
como odio el wifi casa          	anger
y lo no espera            	sadness
no puedo vivir con esta angustia        	sadness
y en no hay            	anger
uno e jugador hasta conoce pizza borde con    	sadness
dame un beso eso hasta el lunes  pero solo	joy
donde diablos se han ido mi ganas dormir    	sadness
dolor cabeza                	sadness
caga le digan al taco tortilla normal alv    	anger
